item_id,shop_id,shop_name,name,currency,stock,ctime,historical_sold,liked_count,cat_id,brand,price,price_min,price_max,price_min_before_discount,price_max_before_discount,raw_discount,rating_total,rating_1_star,rating_2_star,rating_3_star,rating_4_star,rating_5_star,rating_star,shop_location,crawl_date
23749913648,238618977,ICON DENIM ,Set Đồ Nỉ ICONDENIM Basic Tracksuit SEID0016,VND,31,2023-07-06,91,140,100011,,369000,369000,480000,380000,480000,3,8,0,0,0,1,7,4.875,TP. Hồ Chí Minh,2023-11-17
22255717679,238618977,ICON DENIM ,Áo Polo Nam ICONDENIM Regular Basic Hexgon PLID0105,VND,149,2023-07-06,48,20,100011,,339000,339000,339000,350000,350000,3,7,0,0,0,0,7,5.0,TP. Hồ Chí Minh,2023-11-17
23050195927,238618977,ICON DENIM ,Set Bộ ICONDENIM Orgnls SEID0013,VND,71,2023-07-06,63,78,100011,,319000,319000,319000,330000,330000,3,6,0,0,0,0,6,5.0,TP. Hồ Chí Minh,2023-11-17
23384451634,238618977,ICON DENIM ,Quần Short Pique ICONDENIM Regular Decup Combination QSID0143,VND,172,2023-07-06,20,4,100011,,289000,289000,289000,300000,300000,4,4,0,0,0,0,4,5.0,TP. Hồ Chí Minh,2023-11-17
23813479449,238618977,ICON DENIM ,Quần Jean Nam Smart Jeans ICONDENIM Super Dark Blue QJID0121,VND,4,2023-07-06,150,46,100011,,549000,549000,549000,590000,590000,7,57,0,0,0,2,55,4.964912280701754,TP. Hồ Chí Minh,2023-11-17
16798284458,238618977,ICON DENIM ,Áo Polo Nam ICONDENIM Regular In Logo PLID0077,VND,190,2023-07-06,198,72,100011,,279000,279000,279000,320000,320000,13,43,0,0,0,0,43,5.0,TP. Hồ Chí Minh,2023-11-17
23083757597,238618977,ICON DENIM ,Áo Thun Nam ICONDENIM Regular Do It Silently ATID0270,VND,15,2023-07-06,5,4,100011,,309000,309000,320000,320000,320000,3,1,0,0,0,0,1,5.0,TP. Hồ Chí Minh,2023-11-17
22373545651,238618977,ICON DENIM ,Quần Boxer ICONDENIM Coolmax Polyester Fabric BXID0016,VND,2,2023-07-07,196,25,100011,,89000,89000,89000,100000,100000,11,23,0,0,0,0,23,5.0,TP. Hồ Chí Minh,2023-11-17
22783741155,238618977,ICON DENIM ,Quần Jogger Nam ICONDENIM Logo Thêu JGID0037,VND,52,2023-07-08,12,2,100011,,439000,439000,450000,450000,450000,2,2,0,0,0,0,2,5.0,TP. Hồ Chí Minh,2023-11-17
12299206003,238618977,ICON DENIM ,Set Đồ ICONDENIM Logo Black-Pink Printed SEID0025,VND,242,2023-07-10,30,12,100011,,279000,279000,309000,290000,320000,13,6,0,0,0,0,6,5.0,TP. Hồ Chí Minh,2023-11-17
22649826707,238618977,ICON DENIM ,Quần Tây Nam Skinny ICONDENIM Lưng Phối Thun QTID0031,VND,40,2023-07-10,28,5,100011,,369000,369000,369000,380000,380000,3,8,1,0,0,0,7,4.5,TP. Hồ Chí Minh,2023-11-17
18891430900,238618977,ICON DENIM ,Quần Jeans Nam ICONDENIM Slim Crop Blue Wash QJID0120,VND,12,2023-07-11,47,13,100011,,439000,439000,439000,550000,550000,20,13,1,0,0,0,12,4.6923076923076925,TP. Hồ Chí Minh,2023-11-17
23775679624,238618977,ICON DENIM ,Áo Sơmi Nam Tay Dài Oxford ICONDENIM Basic Phối Wolf Pattern SMID0106,VND,6,2023-07-11,50,38,100011,,279000,279000,279000,350000,350000,20,14,0,1,0,1,12,4.714285714285714,TP. Hồ Chí Minh,2023-11-17
23850039824,238618977,ICON DENIM ,Áo Thun Unisex ICONDENIM Logo Text Overlay Printed ATID0211,VND,22,2023-07-11,88,19,100011,,269000,269000,269000,280000,280000,4,21,0,0,0,1,20,4.9523809523809526,TP. Hồ Chí Minh,2023-11-17
21484177250,238618977,ICON DENIM ,Áo Khoác ICONDENIM Regular Surpass To Be Active AKID0116,VND,40,2023-07-11,33,20,100011,,479000,479000,479000,490000,490000,2,8,0,0,0,0,8,5.0,TP. Hồ Chí Minh,2023-11-17
23758234809,238618977,ICON DENIM ,Set Đồ ICONDENIM Cozy Green And White SEID0020,VND,39,2023-07-11,9,4,100011,,279000,279000,309000,290000,320000,4,2,0,0,0,0,2,5.0,TP. Hồ Chí Minh,2023-11-17
22379415371,238618977,ICON DENIM ,Quần Jeans Nam ICONDENIM Skinny Blue Wash QJID0142,VND,14,2023-07-11,33,12,100011,,539000,539000,539000,550000,550000,2,11,0,0,0,0,11,5.0,TP. Hồ Chí Minh,2023-11-17
21949859775,238618977,ICON DENIM ,Áo Thun Polo Nam Tay Ngắn ICONDENIM Cotton Crazy Bear Form Slim PLID0049,VND,8,2023-07-11,55,32,100011,,229000,229000,229000,350000,350000,35,15,0,0,0,2,13,4.866666666666666,TP. Hồ Chí Minh,2023-11-17
21382747733,238618977,ICON DENIM ,Quần Short Jeans Nam ICONDENIM Slimfit Lưng Thun QSID0076,VND,21,2023-07-11,23,2,100011,,259000,259000,259000,330000,330000,22,4,0,0,0,0,4,5.0,TP. Hồ Chí Minh,2023-11-17
22050065474,238618977,ICON DENIM ,Áo Thun Nam ICONDENIM Hidden Name ATID0200,VND,16,2023-07-11,63,65,100011,,289000,289000,289000,300000,300000,4,16,0,0,0,0,16,5.0,TP. Hồ Chí Minh,2023-11-17
21884480528,238618977,ICON DENIM ,Áo Thun Black Grid ICONDENIM Oversize Originals ATID0251,VND,6,2023-07-11,36,12,100011,,269000,269000,280000,280000,280000,4,9,0,0,0,0,9,5.0,TP. Hồ Chí Minh,2023-11-17
23781203630,238618977,ICON DENIM ,Áo Thun Nam ICONDENIM Regular Abstract Art ATID0257,VND,4,2023-07-11,31,19,100011,,289000,289000,300000,300000,300000,4,11,0,0,0,0,11,5.0,TP. Hồ Chí Minh,2023-11-17
23175415651,238618977,ICON DENIM ,Quần Kaki Nam Technical Fabric ICONDENIM Phối Lưng Thun QKID0016,VND,3,2023-07-11,28,5,100011,,299000,299000,299000,400000,400000,25,11,0,0,0,0,11,5.0,TP. Hồ Chí Minh,2023-11-17
23254038433,238618977,ICON DENIM ,Quần Jeans Nam ICONDENIM Skinny Torn Knee Light Blue QJID0140,VND,23,2023-07-11,7,3,100011,,539000,539000,539000,550000,550000,2,0,0,0,0,0,0,0.0,TP. Hồ Chí Minh,2023-11-17
15299523828,238618977,ICON DENIM ,Áo Thun Streetfood ICONDENIM Pop Art ATID0256,VND,133,2023-07-11,26,3,100011,,279000,279000,279000,290000,290000,4,5,0,0,0,0,5,5.0,TP. Hồ Chí Minh,2023-11-17
16895506525,238618977,ICON DENIM ,Áo Thun Unisex Oversize Vintage Bears ATID0173,VND,10,2023-07-11,33,10,100011,,289000,289000,289000,300000,300000,4,5,0,0,0,0,5,5.0,TP. Hồ Chí Minh,2023-11-17
23355727328,238618977,ICON DENIM ,Áo Thun Nam ICONDENIM The Inspiration Of Flowers ATID0252,VND,46,2023-07-11,21,2,100011,,289000,289000,289000,300000,300000,4,7,0,0,0,0,7,5.0,TP. Hồ Chí Minh,2023-11-17
22080679951,238618977,ICON DENIM ,Áo Khoác Nam Bomber Jacket ICONDENIM Basic AKID0104,VND,82,2023-07-11,37,33,100011,,469000,469000,469000,480000,480000,2,5,0,0,0,0,5,5.0,TP. Hồ Chí Minh,2023-11-17
23381211835,238618977,ICON DENIM ,Áo Polo Nam ICONDENIM Regular Color Scheme Collar PLID0109,VND,8,2023-07-11,63,19,100011,,339000,339000,339000,350000,350000,3,10,0,0,0,1,9,4.9,TP. Hồ Chí Minh,2023-11-17
22954856085,238618977,ICON DENIM ,Áo Khoác In Phản Quang ICONDENIM Sun-Protection AKID01003,VND,19,2023-07-11,55,15,100011,,239000,239000,239000,250000,250000,4,16,0,0,0,1,15,4.9375,TP. Hồ Chí Minh,2023-11-17
23784143175,238618977,ICON DENIM ,Áo Thun Unisex ICONDENIM Domino Four - 4th Anniversary 240GSM ATID0291,VND,56,2023-07-11,7,0,100011,,309000,309000,309000,320000,320000,3,1,0,0,0,0,1,5.0,TP. Hồ Chí Minh,2023-11-17
22375430802,238618977,ICON DENIM ,Quần Kaki Skinny Nam ICONDENIM Phối Lưng Thun QKID0024,VND,30,2023-07-11,54,9,100011,,379000,379000,390000,390000,390000,3,16,0,0,0,0,16,5.0,TP. Hồ Chí Minh,2023-11-17
23475397300,238618977,ICON DENIM ,Áo Hoodie Brklyn Form Regular,VND,1,2023-07-12,31,6,100011,,400000,400000,400000,-1,-1,0,9,0,0,0,0,9,5.0,TP. Hồ Chí Minh,2023-11-17
22449708688,238618977,ICON DENIM ,Quần Jean Smart Jeans ICONDENIM Blue Mid Wash QJID0118,VND,27,2023-07-12,138,40,100011,,549000,549000,590000,590000,590000,7,37,0,0,1,2,34,4.891891891891892,TP. Hồ Chí Minh,2023-11-17
8358832674,238618977,ICON DENIM ,Áo Thun Nam Cotton ICONDENIM Regular The Dogfather Cool Ngầu ATID0075,VND,61,2023-07-12,274,154,100011,,229000,229000,229000,300000,300000,24,97,2,0,4,5,86,4.783505154639175,TP. Hồ Chí Minh,2023-11-17
23376329711,238618977,ICON DENIM ,Túi Đeo Chéo Da ICONDENIM 2 Sọc TUID0015,VND,42,2023-07-12,4,4,100533,,459000,459000,459000,580000,580000,21,3,0,0,0,0,3,5.0,TP. Hồ Chí Minh,2023-11-17
23884144641,238618977,ICON DENIM ,Áo Thun Unisex ICONDENIM Play Fun 4 All -  4th Anniversary 240 GSM ATID0294,VND,77,2023-07-12,8,2,100011,,309000,309000,309000,320000,320000,3,3,0,0,0,0,3,5.0,TP. Hồ Chí Minh,2023-11-17
19640162774,238618977,ICON DENIM ,Set Đồ Ngắn Nỉ Chân Cua Cotton Nam ICONDENIM Regular Form ORGNLS SEID0007,VND,272,2023-07-12,342,321,100011,,249000,249000,290000,280000,290000,14,52,0,0,0,3,49,4.9423076923076925,TP. Hồ Chí Minh,2023-11-17
23575511021,238618977,ICON DENIM ,Quần Jeans Nam Skinny Heavy Blue Wash QJID0099,VND,17,2023-07-12,7,4,100011,,539000,539000,539000,550000,550000,2,4,0,0,0,0,4,5.0,TP. Hồ Chí Minh,2023-11-17
14698351986,238618977,ICON DENIM ,"Áo Thun Nam ICONDENIM Play, Cheer, Enjoy, Repeat - 4th Anniversary 240GSM ATID0292",VND,38,2023-07-12,7,0,100011,,309000,309000,309000,320000,320000,3,2,0,0,0,1,1,4.5,TP. Hồ Chí Minh,2023-11-17
23712631573,238618977,ICON DENIM ,Quần Jeans Nam ICONDENIM Smart Jeans Form Smart Fit Blue QJID0116,VND,34,2023-07-12,162,45,100011,,549000,549000,549000,590000,590000,7,49,0,1,0,0,48,4.938775510204081,TP. Hồ Chí Minh,2023-11-17
22484453108,238618977,ICON DENIM ,Túi Đeo Chéo ICONDENIM Landscape Crossbody TUID0024,VND,39,2023-07-13,1,1,100533,,279000,279000,279000,290000,290000,4,0,0,0,0,0,0,0.0,TP. Hồ Chí Minh,2023-11-17
22583621918,238618977,ICON DENIM ,Áo Sweater Nỉ Nam ICONDENIM Sphynx Cat Printed SWID0018,VND,21,2023-07-13,3,3,100011,,399000,399000,399000,450000,450000,11,1,0,0,0,0,1,5.0,TP. Hồ Chí Minh,2023-11-17
19033313993,238618977,ICON DENIM ,Áo Sơ Mi Nam Cotton Lụa Tay Ngắn ICON DENIM Typo Pattern Trẻ Trung Thoải Mái SMID0011,VND,152,2023-07-13,261,111,100011,,289000,289000,289000,300000,300000,4,88,0,0,0,2,86,4.9772727272727275,TP. Hồ Chí Minh,2023-11-17
22984435335,238618977,ICON DENIM ,Áo Khoác Nam ICONDENIM Windproof Flexible Sleeves AKID0113,VND,47,2023-07-14,11,4,100011,,409000,409000,409000,420000,420000,3,2,0,0,0,0,2,5.0,TP. Hồ Chí Minh,2023-11-17
17899238175,238618977,ICON DENIM ,Áo Polo Nam ICONDENIM Regular Drafting Mix 230GSM PLID0106,VND,22,2023-07-14,7,3,100011,,339000,339000,339000,350000,350000,3,3,0,0,0,0,3,5.0,TP. Hồ Chí Minh,2023-11-17
20784448305,238618977,ICON DENIM ,Áo Sơmi Nam ICONDENIM Slimfit Elegant Vibe SMID0152,VND,83,2023-07-14,32,13,100011,,339000,339000,350000,350000,350000,3,5,0,0,0,0,5,5.0,TP. Hồ Chí Minh,2023-11-17
22649712670,238618977,ICON DENIM ,Quần Jean Smart Jeans ICONDENIM Dark Blue 2 QJID0115,VND,6,2023-07-14,79,14,100011,,549000,549000,590000,590000,590000,7,28,0,0,0,0,28,5.0,TP. Hồ Chí Minh,2023-11-17
17899322680,238618977,ICON DENIM ,Quần Short Jeans Nam ICONDENIM Cargo Garment Washing QSID0149,VND,31,2023-07-14,1,2,100011,,409000,409000,420000,420000,420000,3,1,0,0,0,0,1,5.0,TP. Hồ Chí Minh,2023-11-17
18543896915,238618977,ICON DENIM ,Áo Polo Nam Cotton ICONDENIM Regular Navy Phối Sọc Thanh Lịch PLID0014,VND,172,2023-07-17,76,28,100011,,259000,259000,259000,350000,350000,26,24,0,0,1,2,21,4.833333333333333,TP. Hồ Chí Minh,2023-11-17
20091359441,238618977,ICON DENIM ,Quần Short Linen ICONDENIM Hybrid Waist Embroider QSID0140,VND,55,2023-07-17,52,4,100011,,289000,289000,289000,300000,300000,4,11,0,0,0,0,11,5.0,TP. Hồ Chí Minh,2023-11-17
17698784519,238618977,ICON DENIM ,Quần Jeans Nam Skinny ICONDENIM Retro Streetstyle QJID0150,VND,38,2023-07-17,16,4,100011,,539000,539000,539000,550000,550000,2,7,0,0,0,0,7,5.0,TP. Hồ Chí Minh,2023-11-17
19791387857,238618977,ICON DENIM ,Set Bộ Basic ICONDENIM Trần Trám SEID0018,VND,34,2023-07-17,25,5,100011,,239000,239000,320000,250000,320000,4,5,0,0,1,0,4,4.6,TP. Hồ Chí Minh,2023-11-17
19085618728,238618977,ICON DENIM ,Áo Polo Nam ICONDENIM Activeness In Black PLID0031,VND,63,2023-07-18,7,3,100011,,339000,339000,339000,350000,350000,3,1,0,0,0,0,1,5.0,TP. Hồ Chí Minh,2023-11-17
17598948747,238618977,ICON DENIM ,Áo Khoác Nam Windjacket Vải Dù 2 Lớp ICONDENIM Sun Protection Jacket AKID0119,VND,1,2023-07-18,24,16,100011,,479000,479000,479000,490000,490000,2,11,1,0,0,1,9,4.545454545454546,TP. Hồ Chí Minh,2023-11-17
22781209390,238618977,ICON DENIM ,Áo Thun Regular ICONDENIM Pattern Typo 260GSM ATID0269,VND,101,2023-07-19,3,5,100011,,289000,289000,289000,300000,300000,4,2,0,0,0,0,2,5.0,TP. Hồ Chí Minh,2023-11-17
23349904156,238618977,ICON DENIM ,Áo Khoác Caro Basic Good Day,VND,332,2023-07-19,30,18,100011,,275000,275000,550000,550000,550000,50,12,0,0,1,0,11,4.833333333333333,TP. Hồ Chí Minh,2023-11-17
23024578742,238618977,ICON DENIM ,Quần Jean Nam ICONDENIM Slim Fit Dark Blue Whiskering QJID0084,VND,6,2023-07-19,79,25,100011,,439000,439000,439000,550000,550000,20,24,0,0,0,0,24,5.0,TP. Hồ Chí Minh,2023-11-17
18792914141,238618977,ICON DENIM ,Áo Khoác Denim Classic Assemble AKID0111,VND,21,2023-07-19,22,16,100011,,569000,569000,569000,650000,650000,12,4,0,0,0,0,4,5.0,TP. Hồ Chí Minh,2023-11-17
17598296846,238618977,ICON DENIM ,Áo Khoác Bomber Color Block,VND,28,2023-07-19,7,5,100011,,319000,319000,420000,420000,420000,24,1,0,0,0,0,1,5.0,TP. Hồ Chí Minh,2023-11-17
18560062933,238618977,ICON DENIM ,Set Nỉ Nam ICON DENIM In Full Pattern Thoải Mái Trẻ Trung SEID0003,VND,8,2023-07-19,120,61,100011,,159000,159000,159000,300000,300000,47,30,0,0,0,0,30,5.0,TP. Hồ Chí Minh,2023-11-17
19393251829,238618977,ICON DENIM ,Áo Khoác Nam Spray Paint AKID0096,VND,16,2023-07-19,5,2,100011,,299000,299000,299000,480000,480000,38,3,0,0,0,0,3,5.0,TP. Hồ Chí Minh,2023-11-17
22149922519,238618977,ICON DENIM ,Quần Short Jeans Nam ICONDENIM Slim Torned Blue Wash QSID0122,VND,25,2023-07-19,10,2,100011,,339000,339000,339000,350000,350000,3,4,0,0,0,0,4,5.0,TP. Hồ Chí Minh,2023-11-17
22579708157,238618977,ICON DENIM ,Áo Khoác Raglan ICONDENIM Colorblock AKID0112,VND,69,2023-07-19,10,3,100011,,439000,439000,439000,450000,450000,2,1,0,0,0,1,0,4.0,TP. Hồ Chí Minh,2023-11-17
19194462511,238618977,ICON DENIM ,Áo Thun Nam ICONDENIM 4 Years Of Adventure - 4th Anniversary 240GSM ATID0293,VND,96,2023-07-19,4,1,100011,,309000,309000,309000,320000,320000,3,0,0,0,0,0,0,0.0,TP. Hồ Chí Minh,2023-11-17
22384435045,238618977,ICON DENIM ,Áo Thun Unisex ICONDENIM Regular Bobmarley ATID0263,VND,28,2023-07-19,5,1,100011,,289000,289000,289000,300000,300000,4,1,0,0,0,0,1,5.0,TP. Hồ Chí Minh,2023-11-17
23450143341,238618977,ICON DENIM ,Áo Thun Unisex Cổ Tròn ICONDENIM Basic Ready-To-Wear ATID0191,VND,58,2023-07-19,60,16,100011,,239000,239000,239000,250000,250000,4,17,0,0,0,1,16,4.9411764705882355,TP. Hồ Chí Minh,2023-11-17
22953925498,238618977,ICON DENIM ,Quần Jeans Nam ICONDENIM Slimfit Dark Blue Wash QJID0130,VND,8,2023-07-19,35,3,100011,,539000,539000,550000,550000,550000,2,11,0,0,1,0,10,4.818181818181818,TP. Hồ Chí Minh,2023-11-17
16898300844,238618977,ICON DENIM ,Áo Sơmi Caro Tay Dài SMID0065,VND,168,2023-07-19,21,10,100011,,300000,300000,300000,-1,-1,0,9,0,0,1,0,8,4.777777777777778,TP. Hồ Chí Minh,2023-11-17
20743606449,238618977,ICON DENIM ,Áo Sơmi Nam Trơn Tay Dài ICONDENIM Slim Fit Silkly Thanh Lịch SMID0075,VND,163,2023-07-19,717,197,100011,,279000,279000,279000,330000,330000,15,184,3,0,5,11,165,4.820652173913044,TP. Hồ Chí Minh,2023-11-17
9583542337,238618977,ICON DENIM ,Áo Sơ Mi Nam ICON DENIM Tay Dài Công Sở Dáng Ôm Form Slimfit Silky Soft Trơn Vải Lụa Không Nhăn SMID0046,VND,1,2023-07-19,830,380,100011,,229000,229000,229000,350000,350000,35,258,6,4,5,15,228,4.763565891472868,TP. Hồ Chí Minh,2023-11-17
21891422951,238618977,ICON DENIM ,Áo Thun Wash Embroider Form Regular ATID0240,VND,8,2023-07-20,48,8,100011,,239000,239000,239000,300000,300000,20,22,0,0,0,0,22,5.0,TP. Hồ Chí Minh,2023-11-17
23018767453,238618977,ICON DENIM ,Quần Jeans Nam Trơn ICONDENIM Slim Fit Blue Wash QJID0096,VND,1,2023-07-20,93,31,100011,,409000,409000,409000,550000,550000,26,34,0,0,0,3,31,4.911764705882353,TP. Hồ Chí Minh,2023-11-17
19184488514,238618977,ICON DENIM ,Áo Thun ICONDENIM Regular Special Basketball Hoop ATID0262,VND,19,2023-07-21,9,1,100011,,279000,279000,290000,290000,290000,4,1,0,0,0,0,1,5.0,TP. Hồ Chí Minh,2023-11-17
22575408378,238618977,ICON DENIM ,Áo Sơmi Linen Henley SMID0080,VND,29,2023-07-24,13,6,100011,,309000,309000,309000,320000,320000,3,1,0,0,0,0,1,5.0,TP. Hồ Chí Minh,2023-11-17
19384493287,238618977,ICON DENIM ,Áo Thun Unisex ICONDENIM The Beginning Of Happiness ATID0254,VND,1,2023-07-24,37,14,100011,,280000,280000,280000,-1,-1,0,10,1,0,0,1,8,4.5,TP. Hồ Chí Minh,2023-11-17
23850022266,238618977,ICON DENIM ,Quần Jeans Nam ICONDENIM Slim Fit Dark Blue QJID0135,VND,33,2023-07-24,31,5,100011,,539000,539000,539000,550000,550000,2,11,0,0,0,1,10,4.909090909090909,TP. Hồ Chí Minh,2023-11-17
17199321488,238618977,ICON DENIM ,Áo Polo Nam ICONDENIM Milk Coffee Striped PLID0082,VND,6,2023-07-24,3,2,100011,,339000,339000,350000,350000,350000,3,0,0,0,0,0,0,0.0,TP. Hồ Chí Minh,2023-11-17
18892852905,238618977,ICON DENIM ,Quần Jeans Nam ICONDENIM Skinny Classic Blue Wash QJID0145,VND,97,2023-07-24,16,3,100011,,539000,539000,539000,550000,550000,2,12,0,0,0,0,12,5.0,TP. Hồ Chí Minh,2023-11-17
22254138903,238618977,ICON DENIM ,Áo Khoác Bomber Varsity Contrast Sleeves AKID0080,VND,31,2023-07-24,5,6,100011,,646000,646000,646000,680000,680000,5,1,0,0,0,0,1,5.0,TP. Hồ Chí Minh,2023-11-17
16695974325,238618977,ICON DENIM ,Quần Jeans Nam Skinny ICONDENIM Grey Wash QJID0147,VND,18,2023-07-24,16,3,100011,,539000,539000,539000,550000,550000,2,7,0,0,0,0,7,5.0,TP. Hồ Chí Minh,2023-11-17
22884438280,238618977,ICON DENIM ,Quần Jean  Nam Skinny ICONDENIM Wash Festive Logo Embroider QJID0131,VND,19,2023-07-24,4,1,100011,,539000,539000,550000,550000,550000,2,1,0,0,0,0,1,5.0,TP. Hồ Chí Minh,2023-11-17
22658241115,238618977,ICON DENIM ,Áo Polo Nam ICONDENIM Pattern Tex PLID0090,VND,40,2023-07-24,5,1,100011,,339000,339000,350000,350000,350000,3,1,0,1,0,0,0,2.0,TP. Hồ Chí Minh,2023-11-17
19159816827,238618977,ICON DENIM ,Áo Khoác Nam Flannel ICON DENIM Regular Form Caro Nâu AKID0056,VND,9,2023-07-24,32,146,100011,,419000,419000,419000,650000,650000,36,9,0,0,1,0,8,4.777777777777778,TP. Hồ Chí Minh,2023-11-17
22355624693,238618977,ICON DENIM ,Quần Jeans Nam ICONDENIM Straight Label Weaving QJID0152,VND,4,2023-07-24,7,6,100011,,539000,539000,539000,550000,550000,2,2,0,0,0,0,2,5.0,TP. Hồ Chí Minh,2023-11-17
19493136414,238618977,ICON DENIM ,Áo Khoác Nam ICONDENIM Denim Basic AKID0110,VND,17,2023-07-24,12,8,100011,,569000,569000,569000,580000,580000,2,4,0,0,0,0,4,5.0,TP. Hồ Chí Minh,2023-11-17
23579630351,238618977,ICON DENIM ,Áo Thun Nam ICONDENIM Perseverance ATID0235,VND,55,2023-07-24,20,4,100011,,289000,289000,289000,300000,300000,4,7,1,0,0,0,6,4.428571428571429,TP. Hồ Chí Minh,2023-11-17
20384179010,238618977,ICON DENIM ,Áo Khoác Dù WindJacket ICONDENIM Lightweight AKID0082,VND,8,2023-07-24,11,7,100011,,424000,424000,530000,530000,530000,20,2,0,0,0,0,2,5.0,TP. Hồ Chí Minh,2023-11-17
22650016616,238618977,ICON DENIM ,Quần Jeans Skinny Nam ICONDENIM Vẩy Sơn Light Blue QJID0141,VND,56,2023-07-24,13,6,100011,,499000,499000,499000,550000,550000,9,4,0,0,0,0,4,5.0,TP. Hồ Chí Minh,2023-11-17
20392844341,238618977,ICON DENIM ,Quần Jeans Nam ICONDENIM Skinny Sharp Wash QJID0146,VND,32,2023-07-25,4,0,100011,,539000,539000,539000,550000,550000,2,3,0,0,0,0,3,5.0,TP. Hồ Chí Minh,2023-11-17
21791389343,238618977,ICON DENIM ,Quần Short Nỉ Nam Pique ICONDENIM QSID0132,VND,40,2023-07-25,32,4,100011,,289000,289000,289000,300000,300000,4,8,0,0,0,0,8,5.0,TP. Hồ Chí Minh,2023-11-17
7558579176,238618977,ICON DENIM ,Quần Short Nam Thể Thao ICONDENIM Signature In Black QSEC0006,VND,78,2023-07-25,286,297,100011,ICON DENIM,239000,239000,239000,250000,250000,4,80,2,1,4,6,67,4.6875,TP. Hồ Chí Minh,2023-11-17
20392841913,238618977,ICON DENIM ,Quần Jeans Nam ICONDENIM Skinny Dark Blue Wash QJID0144,VND,24,2023-07-25,8,3,100011,,539000,539000,539000,550000,550000,2,3,0,0,0,0,3,5.0,TP. Hồ Chí Minh,2023-11-17
22681217713,238618977,ICON DENIM ,Áo Polo Nam ICONDENIM Regular Horizonal Stripes PLID0103,VND,41,2023-07-25,4,0,100011,,339000,339000,339000,350000,350000,3,0,0,0,0,0,0,0.0,TP. Hồ Chí Minh,2023-11-17
23376334916,238618977,ICON DENIM ,Quần Short Ngủ Nam ICONDENIM Pattern Printed QSID0114,VND,12,2023-07-25,15,3,100011,,108000,108000,120000,120000,120000,10,5,0,0,0,0,5,5.0,TP. Hồ Chí Minh,2023-11-17
16296062491,238618977,ICON DENIM ,Áo Khoác Leather Bomber ICONDENIM Da The Winners AKID0091,VND,16,2023-07-25,11,6,100011,,525000,525000,525000,750000,750000,30,2,0,0,0,0,2,5.0,TP. Hồ Chí Minh,2023-11-17
22176325349,238618977,ICON DENIM ,Ví Kẹp Nam ICONDENIM Leather VIID0009,VND,25,2023-07-25,3,2,100533,,361000,361000,361000,380000,380000,5,2,0,0,0,1,1,4.5,TP. Hồ Chí Minh,2023-11-17
22884456770,238618977,ICON DENIM ,Áo Polo Nam ICONDENIM Elegant Alphabet PLID0102,VND,99,2023-07-25,3,3,100011,,339000,339000,339000,350000,350000,3,1,0,0,0,0,1,5.0,TP. Hồ Chí Minh,2023-11-17
23976350283,238618977,ICON DENIM ,Dép Quai Da ICONDENIM Comfy GDID0011,VND,41,2023-07-25,6,4,100012,,269000,269000,269000,330000,330000,18,3,0,0,0,0,3,5.0,TP. Hồ Chí Minh,2023-11-17
15998119787,238618977,ICON DENIM ,Áo Khoác Chagi Waterproof AKID0099,VND,11,2023-07-25,19,45,100011,,469000,469000,469000,480000,480000,2,4,0,0,0,0,4,5.0,TP. Hồ Chí Minh,2023-11-17
7245415641,238618977,ICON DENIM ,Quần Short Nỉ Nam ICONDENIM Essentials QSID0066,VND,44,2023-07-26,151,50,100011,ICON DENIM,269000,269000,269000,350000,350000,23,40,0,1,1,1,37,4.85,TP. Hồ Chí Minh,2023-11-17
23149902620,238618977,ICON DENIM ,Túi Đeo Chéo ICONDENIM Mini Reporter ORGNLS TUID0018,VND,10,2023-07-26,6,6,100533,,522500,522500,522500,550000,550000,5,2,0,0,0,0,2,5.0,TP. Hồ Chí Minh,2023-11-17
22324921280,238618977,ICON DENIM ,Áo Thun Unisex Cổ Tròn ICONDENIM Form Dày Dặn Go Ahead ATID0196,VND,3,2023-07-26,49,6,100011,,289000,289000,289000,300000,300000,4,14,0,0,0,2,12,4.857142857142857,TP. Hồ Chí Minh,2023-11-17
9919424859,238618977,ICON DENIM ,Áo Thun Polo Nam Trơn ICONDENIM Basic Slim Fit Thêu Logo Signature PLEC0004,VND,37,2023-07-26,683,296,100011,ICON DENIM,299000,299000,299000,420000,420000,29,190,2,2,6,7,173,4.826315789473684,TP. Hồ Chí Minh,2023-11-17
19583904004,238618977,ICON DENIM ,Quần Jean Nam ICONDENIM Skinny Light Grey QJID0128,VND,42,2023-07-26,7,5,100011,,440000,440000,550000,550000,550000,20,0,0,0,0,0,0,0.0,TP. Hồ Chí Minh,2023-11-17
21493249962,238618977,ICON DENIM ,Áo Khoác Nhung Tăm ICONDENIM Black Wash AKID0068,VND,15,2023-07-26,9,2,100011,,464000,464000,464000,580000,580000,20,1,0,0,0,1,0,4.0,TP. Hồ Chí Minh,2023-11-17
19782448309,238618977,ICON DENIM ,Quần Kaki Nam ICONDENIM Slim-Fit Smart Basic QKID0023,VND,37,2023-07-27,23,9,100011,,389000,389000,400000,400000,400000,3,7,0,0,0,1,6,4.857142857142857,TP. Hồ Chí Minh,2023-11-17
22880372858,238618977,ICON DENIM ,Áo Khoác ICONDENIM White Sleeves Scheme AKID0109,VND,40,2023-07-27,3,4,100011,,439000,439000,439000,450000,450000,2,1,0,0,0,0,1,5.0,TP. Hồ Chí Minh,2023-11-17
19383871464,238618977,ICON DENIM ,Quần Jeans Skinny Blue Wash W Rips QJID0132,VND,34,2023-07-27,7,0,100011,,440000,440000,440000,550000,550000,20,2,0,0,0,1,1,4.5,TP. Hồ Chí Minh,2023-11-17
13699041925,238618977,ICON DENIM ,Áo Khoác Bomber Utility Flight,VND,22,2023-07-27,28,18,100011,,339000,339000,339000,450000,450000,25,7,0,0,0,0,7,5.0,TP. Hồ Chí Minh,2023-11-17
18191716218,238618977,ICON DENIM ,Quần Jeans Nam Skinny ICONDENIM Wash W Orgnls Embroider QJID0139,VND,46,2023-07-28,2,0,100011,,509000,509000,509000,550000,550000,7,1,0,0,0,0,1,5.0,TP. Hồ Chí Minh,2023-11-17
17495987034,238618977,ICON DENIM ,Áo Khoác Mountain God AKID0097,VND,7,2023-07-28,16,1,100011,,469000,469000,480000,480000,480000,2,5,0,0,0,0,5,5.0,TP. Hồ Chí Minh,2023-11-17
23150020695,238618977,ICON DENIM ,Quần Jeans ICONDENIM Skinny Acid Heavy Wash QJID0098,VND,32,2023-07-28,13,6,100011,,499000,499000,499000,550000,550000,9,2,0,0,0,0,2,5.0,TP. Hồ Chí Minh,2023-11-17
22054139279,238618977,ICON DENIM ,Áo Thun ICONDENIM Alphabet Street Style ATID0228,VND,34,2023-07-28,8,4,100011,,289000,289000,289000,300000,300000,4,3,0,0,0,0,3,5.0,TP. Hồ Chí Minh,2023-11-17
23150862347,238618977,ICON DENIM ,Áo Vest Nam ICONDENIM Classic Gentle AVID0001,VND,12,2023-07-28,1,4,100011,,760000,760000,760000,800000,800000,5,1,0,0,0,0,1,5.0,TP. Hồ Chí Minh,2023-11-17
17192160579,238618977,ICON DENIM ,Áo Sơmi Nam Tay Ngắn ICONDENIM Vải Lụa Relaxed Fit Crane Birds SMID0073,VND,1,2023-07-29,62,71,100011,,319000,319000,319000,330000,330000,3,15,0,0,1,0,14,4.866666666666666,TP. Hồ Chí Minh,2023-11-17
13999769569,238618977,ICON DENIM ,Áo Khoác Bomber Drafting Line AKID0117,VND,83,2023-07-29,6,1,100011,,439000,439000,439000,450000,450000,2,2,0,0,0,0,2,5.0,TP. Hồ Chí Minh,2023-11-17
23750845230,238618977,ICON DENIM ,Quần Short Jeans Nam ICONDENIM Lưng Thun Phối Rập QSID0069,VND,25,2023-07-29,11,3,100011,,309000,309000,309000,330000,330000,6,3,0,0,0,0,3,5.0,TP. Hồ Chí Minh,2023-11-17
14997937791,238618977,ICON DENIM ,Balo Da ICONDENIM Classic In Black BLID0004,VND,4,2023-07-29,0,4,100533,,807500,807500,807500,850000,850000,5,0,0,0,0,0,0,0.0,TP. Hồ Chí Minh,2023-11-17
16398336039,238618977,ICON DENIM ,Áo Khoác Bomber Linen Nam ICONDENIM Casual AKID0062,VND,15,2023-07-29,30,26,100011,,339000,339000,450000,450000,450000,25,6,1,1,0,0,4,3.8333333333333335,TP. Hồ Chí Minh,2023-11-17
15398193828,238618977,ICON DENIM ,Áo Thun Special Quotes ICONDENIM Orgnls ATID0268,VND,90,2023-07-30,5,3,100011,,269000,269000,269000,280000,280000,4,1,0,0,0,0,1,5.0,TP. Hồ Chí Minh,2023-11-17
14597927770,238618977,ICON DENIM ,Quần Jeans Skinny Nam ICONDENIM Blue Wash Heavy Rips QJDI0129,VND,6,2023-07-30,3,1,100011,,509000,509000,509000,550000,550000,7,0,0,0,0,0,0,0.0,TP. Hồ Chí Minh,2023-11-17
