item_id,shop_id,shop_name,name,currency,stock,ctime,historical_sold,liked_count,cat_id,brand,price,price_min,price_max,price_min_before_discount,price_max_before_discount,raw_discount,rating_total,rating_1_star,rating_2_star,rating_3_star,rating_4_star,rating_5_star,rating_star,shop_location,crawl_date
21747272266,238618977,ICON DENIM ,Áo Polo Nam Tay Ngắn ICONDENIM ORGNLS Slim Fit Thanh Lịch Trẻ Trung PLID0023,VND,70,2023-07-07,252,74,100011,,259000,259000,259000,350000,350000,26,75,0,0,0,1,74,4.986666666666666,TP. Hồ Chí Minh,2023-11-24
23024578742,238618977,ICON DENIM ,Quần Jean Nam ICONDENIM Slim Fit Dark Blue Whiskering QJID0084,VND,26,2023-07-07,81,30,100011,,449000,449000,449000,550000,550000,18,25,0,0,0,0,25,5.0,TP. Hồ Chí Minh,2023-11-24
20091359441,238618977,ICON DENIM ,Quần Short Linen ICONDENIM Hybrid Waist Embroider QSID0140,VND,68,2023-07-08,54,6,100011,,269000,269000,269000,300000,300000,10,12,0,0,0,0,12,5.0,TP. Hồ Chí Minh,2023-11-24
18491579018,238618977,ICON DENIM ,Áo Thun Unisex ICONDENIM Cozy Moment ATID0255,VND,8,2023-07-10,82,41,100011,,229000,229000,229000,280000,280000,18,16,0,0,0,0,16,5.0,TP. Hồ Chí Minh,2023-11-24
22053763583,238618977,ICON DENIM ,Quần Shorts Smart Jeans ICONDENIM Black-Grey Smart Fit QSID0145,VND,55,2023-07-10,35,12,100011,,379000,379000,379000,420000,420000,10,11,0,0,0,0,11,5.0,TP. Hồ Chí Minh,2023-11-24
21951739472,238618977,ICON DENIM ,Áo Khoác Jean Nam ICONDENIM Xám Wash Chất liệu Jean Dày Dặn Thời Trang Có Túi Trong AKID0048,VND,1,2023-07-11,345,237,100011,,479000,479000,479000,580000,580000,17,101,0,1,2,8,90,4.851485148514851,TP. Hồ Chí Minh,2023-11-24
22954856085,238618977,ICON DENIM ,Áo Khoác In Phản Quang ICONDENIM Sun-Protection AKID01003,VND,9,2023-07-11,62,16,100011,,199000,199000,199000,250000,250000,20,19,0,0,0,1,18,4.947368421052632,TP. Hồ Chí Minh,2023-11-24
18083824187,238618977,ICON DENIM ,Quần Shorts Smart Jeans ICONDENIM Blue Ripped QSID0144,VND,83,2023-07-11,34,14,100011,,379000,379000,379000,420000,420000,10,6,0,0,0,0,6,5.0,TP. Hồ Chí Minh,2023-11-24
22953925498,238618977,ICON DENIM ,Quần Jeans Nam ICONDENIM Slimfit Dark Blue Wash QJID0130,VND,8,2023-07-11,38,4,100011,,399000,399000,399000,550000,550000,27,11,0,0,1,0,10,4.818181818181818,TP. Hồ Chí Minh,2023-11-24
23450871925,238618977,ICON DENIM ,Áo Sơmi Nam Tay Ngắn ICONDENIM Minimalism SlimFit SMID0142,VND,43,2023-07-11,101,34,100011,,249000,249000,249000,280000,280000,11,25,0,0,1,1,23,4.88,TP. Hồ Chí Minh,2023-11-24
18891430900,238618977,ICON DENIM ,Quần Jeans Nam ICONDENIM Slim Crop Blue Wash QJID0120,VND,60,2023-07-11,52,18,100011,,499000,499000,499000,550000,550000,9,13,1,0,0,0,12,4.6923076923076925,TP. Hồ Chí Minh,2023-11-24
22650016616,238618977,ICON DENIM ,Quần Jeans Skinny Nam ICONDENIM Vẩy Sơn Light Blue QJID0141,VND,66,2023-07-11,17,6,100011,,449000,449000,449000,550000,550000,18,4,0,0,0,0,4,5.0,TP. Hồ Chí Minh,2023-11-24
22275196117,238618977,ICON DENIM ,Vớ Ngắn Dệt Cotton ICONDENIM Cổ Thấp Logo VOID0018,VND,6,2023-07-11,454,15,100011,,18000,18000,18000,20000,20000,10,62,1,0,0,1,60,4.919354838709677,TP. Hồ Chí Minh,2023-11-24
19091386595,238618977,ICON DENIM ,Quần Short Kaki Nam ICONDENIM Mordigan QSID0131,VND,45,2023-07-11,110,20,100011,,259000,259000,259000,320000,320000,19,27,0,0,0,0,27,5.0,TP. Hồ Chí Minh,2023-11-24
23150862347,238618977,ICON DENIM ,Áo Vest Nam ICONDENIM Classic Gentle AVID0001,VND,10,2023-07-11,1,5,100011,,649000,649000,649000,800000,800000,19,1,0,0,0,0,1,5.0,TP. Hồ Chí Minh,2023-11-24
22781209390,238618977,ICON DENIM ,Áo Thun Regular ICONDENIM Pattern Typo 260GSM ATID0269,VND,72,2023-07-11,6,6,100011,,239000,239000,239000,300000,300000,20,2,0,0,0,0,2,5.0,TP. Hồ Chí Minh,2023-11-24
22373545651,238618977,ICON DENIM ,Quần Boxer ICONDENIM Coolmax Polyester Fabric BXID0016,VND,5,2023-07-11,207,24,100011,,89000,89000,89000,100000,100000,11,24,0,0,0,0,24,5.0,TP. Hồ Chí Minh,2023-11-24
20084474503,238618977,ICON DENIM ,Set Đồ Wash Cargo ICONDENIM Dark Grey SEID0022,VND,91,2023-07-11,34,14,100011,,289000,289000,289000,320000,420000,31,8,0,0,0,0,8,5.0,TP. Hồ Chí Minh,2023-11-24
20190104752,238618977,ICON DENIM ,Áo Sơ Mi Nam Oxford Dài Tay ICONDENIM Blank Color Embroider Slimfit SMID0144,VND,46,2023-07-11,330,163,100011,,249000,249000,320000,320000,320000,22,69,2,1,1,3,62,4.768115942028985,TP. Hồ Chí Minh,2023-11-24
22175395968,238618977,ICON DENIM ,Túi Đeo Chéo ICONDENIM Logo 3D TUID0017,VND,15,2023-07-11,22,19,100533,,619000,619000,619000,680000,680000,9,4,0,1,0,0,3,4.25,TP. Hồ Chí Minh,2023-11-24
21891417025,238618977,ICON DENIM ,Nón Lưỡi Trai Logo Signature NOID0011,VND,15,2023-07-11,85,78,100009,,179000,179000,179000,200000,200000,11,19,0,0,1,0,18,4.894736842105263,TP. Hồ Chí Minh,2023-11-24
21382747733,238618977,ICON DENIM ,Quần Short Jeans Nam ICONDENIM Slimfit Lưng Thun QSID0076,VND,25,2023-07-11,30,2,100011,,249000,249000,249000,330000,330000,25,4,0,0,0,0,4,5.0,TP. Hồ Chí Minh,2023-11-24
19384493287,238618977,ICON DENIM ,Áo Thun Unisex ICONDENIM The Beginning Of Happiness ATID0254,VND,1,2023-07-11,38,16,100011,,249000,249000,249000,280000,280000,11,11,1,0,0,1,9,4.545454545454546,TP. Hồ Chí Minh,2023-11-24
19033313993,238618977,ICON DENIM ,Áo Sơ Mi Nam Cotton Lụa Tay Ngắn ICON DENIM Typo Pattern Trẻ Trung Thoải Mái SMID0011,VND,47,2023-07-11,265,113,100011,,249000,249000,249000,300000,300000,17,90,0,1,0,2,87,4.944444444444445,TP. Hồ Chí Minh,2023-11-24
16398336039,238618977,ICON DENIM ,Áo Khoác Bomber Linen Nam ICONDENIM Casual AKID0062,VND,20,2023-07-11,31,30,100011,,329000,329000,329000,450000,450000,27,6,1,1,0,0,4,3.8333333333333335,TP. Hồ Chí Minh,2023-11-24
20984474116,238618977,ICON DENIM ,Set Đồ Pique Baskeball ICONDENIM Orgnls SEID0023,VND,148,2023-07-12,48,48,100011,,259000,259000,309000,290000,350000,12,5,0,0,0,0,5,5.0,TP. Hồ Chí Minh,2023-11-24
18891391914,238618977,ICON DENIM ,Quần Kaki Nam ICONDENIM Slim Fit Basic QKID0022,VND,64,2023-07-12,90,21,100011,,359000,359000,359000,400000,400000,10,31,1,0,1,1,28,4.774193548387097,TP. Hồ Chí Minh,2023-11-24
22884456770,238618977,ICON DENIM ,Áo Polo Nam ICONDENIM Elegant Alphabet PLID0102,VND,96,2023-07-12,6,3,100011,,319000,319000,319000,350000,350000,9,1,0,0,0,0,1,5.0,TP. Hồ Chí Minh,2023-11-24
21982460298,238618977,ICON DENIM ,Quần Jogger Nam ICONDENIM Slim Active Day JGID0040,VND,30,2023-07-12,8,6,100011,,349000,349000,349000,420000,420000,17,3,0,0,0,0,3,5.0,TP. Hồ Chí Minh,2023-11-24
23076350182,238618977,ICON DENIM ,Mắt Kính ICONDENIM Gọng Xám Trong Young & Free KIID0014,VND,2,2023-07-12,4,10,100009,,349000,349000,349000,380000,380000,8,1,0,0,0,0,1,5.0,TP. Hồ Chí Minh,2023-11-24
19791387857,238618977,ICON DENIM ,Set Bộ Basic ICONDENIM Trần Trám SEID0018,VND,29,2023-07-12,25,6,100011,,229000,229000,229000,250000,320000,28,5,0,0,1,0,4,4.6,TP. Hồ Chí Minh,2023-11-24
23979540384,238618977,ICON DENIM ,Quần Jean Nam ICONDENIM Skinny Blue Wash W Rips QJID0134,VND,3,2023-07-12,8,2,100011,,419000,419000,419000,550000,550000,24,2,0,0,0,0,2,5.0,TP. Hồ Chí Minh,2023-11-24
22658642215,238618977,ICON DENIM ,Áo Thun Unisex ICONDENIM Cheer Chia Bill - 4th Anniversary 240GSM ATID0290,VND,39,2023-07-12,15,3,100011,,289000,289000,289000,320000,320000,10,6,0,0,0,0,6,5.0,TP. Hồ Chí Minh,2023-11-24
18882446992,238618977,ICON DENIM ,Quần Short Jeans Nam ICONDENIM Dark Blue Wash QSID0123,VND,9,2023-07-13,47,11,100011,,319000,319000,319000,350000,350000,9,13,0,0,0,0,13,5.0,TP. Hồ Chí Minh,2023-11-24
23754024945,238618977,ICON DENIM ,Quần Jeans Nam ICONDENIM Skinny Torn Blue Wash QJID0149,VND,28,2023-07-13,12,5,100011,,499000,499000,499000,550000,550000,9,3,0,0,0,0,3,5.0,TP. Hồ Chí Minh,2023-11-24
22575408378,238618977,ICON DENIM ,Áo Sơmi Linen Henley SMID0080,VND,27,2023-07-14,15,7,100011,,289000,289000,289000,320000,320000,10,3,0,0,0,0,3,5.0,TP. Hồ Chí Minh,2023-11-24
23976350283,238618977,ICON DENIM ,Dép Quai Da ICONDENIM Comfy GDID0011,VND,15,2023-07-14,7,4,100012,,199000,199000,199000,330000,330000,40,3,0,0,0,0,3,5.0,TP. Hồ Chí Minh,2023-11-24
19640162774,238618977,ICON DENIM ,Set Đồ Ngắn Nỉ Chân Cua Cotton Nam ICONDENIM Regular Form ORGNLS SEID0007,VND,242,2023-07-14,342,322,100011,,229000,229000,229000,280000,290000,21,53,0,0,0,3,50,4.943396226415095,TP. Hồ Chí Minh,2023-11-24
13999769569,238618977,ICON DENIM ,Áo Khoác Bomber Drafting Line AKID0117,VND,81,2023-07-14,6,2,100011,,399000,399000,399000,450000,450000,11,2,0,0,0,0,2,5.0,TP. Hồ Chí Minh,2023-11-24
23850039824,238618977,ICON DENIM ,Áo Thun Unisex ICONDENIM Logo Text Overlay Printed ATID0211,VND,27,2023-07-14,91,20,100011,,259000,259000,259000,280000,280000,8,21,1,0,0,1,19,4.761904761904762,TP. Hồ Chí Minh,2023-11-24
23749816053,238618977,ICON DENIM ,Áo Thun Unisex ICONDENIM Neutral Inspiration Regular ATID0242,VND,15,2023-07-17,159,34,100011,,199000,199000,199000,260000,260000,23,35,0,0,0,0,35,5.0,TP. Hồ Chí Minh,2023-11-24
22176325349,238618977,ICON DENIM ,Ví Kẹp Nam ICONDENIM Leather VIID0009,VND,12,2023-07-17,3,1,100533,,329000,329000,329000,380000,380000,13,2,0,0,0,1,1,4.5,TP. Hồ Chí Minh,2023-11-24
20784448305,238618977,ICON DENIM ,Áo Sơmi Nam ICONDENIM Slimfit Elegant Vibe SMID0152,VND,59,2023-07-17,44,16,100011,,319000,319000,319000,350000,350000,9,5,0,0,0,0,5,5.0,TP. Hồ Chí Minh,2023-11-24
21494316248,238618977,ICON DENIM ,Quần Kaki Nam ICONDENIM Straight Fit Classic QKID0026,VND,15,2023-07-17,26,5,100011,,379000,379000,379000,420000,420000,10,5,0,0,0,0,5,5.0,TP. Hồ Chí Minh,2023-11-24
22579708157,238618977,ICON DENIM ,Áo Khoác Raglan ICONDENIM Colorblock AKID0112,VND,67,2023-07-18,12,4,100011,,399000,399000,399000,450000,450000,11,1,0,0,0,1,0,4.0,TP. Hồ Chí Minh,2023-11-24
23450143341,238618977,ICON DENIM ,Áo Thun Unisex Cổ Tròn ICONDENIM Basic Ready-To-Wear ATID0191,VND,89,2023-07-18,65,19,100011,,229000,229000,229000,250000,250000,8,21,0,0,1,1,19,4.857142857142857,TP. Hồ Chí Minh,2023-11-24
23775504507,238618977,ICON DENIM ,Quần Jeans Skinny Classic Dark Wash QJID0126,VND,22,2023-07-19,26,9,100011,,499000,499000,499000,550000,550000,9,11,0,0,0,1,10,4.909090909090909,TP. Hồ Chí Minh,2023-11-24
23813479449,238618977,ICON DENIM ,Quần Jean Nam Smart Jeans ICONDENIM Super Dark Blue QJID0121,VND,53,2023-07-19,166,46,100011,,499000,499000,499000,590000,590000,15,60,0,0,0,2,58,4.966666666666667,TP. Hồ Chí Minh,2023-11-24
19184488514,238618977,ICON DENIM ,Áo Thun ICONDENIM Regular Special Basketball Hoop ATID0262,VND,6,2023-07-19,12,1,100011,,259000,259000,259000,290000,290000,11,1,0,0,0,0,1,5.0,TP. Hồ Chí Minh,2023-11-24
22850044751,238618977,ICON DENIM ,Áo Thun Unisex ICONDENIM Teddy Team ATID0226,VND,1,2023-07-19,101,23,100011,,259000,259000,259000,280000,280000,8,37,0,0,1,2,34,4.891891891891892,TP. Hồ Chí Minh,2023-11-24
20452736374,238618977,ICON DENIM ,Áo Khoác Dù Nam ICONDENIM Regular Lightweight WindbreakerJacket AKID0050,VND,81,2023-07-19,222,71,100011,,309000,309000,309000,420000,420000,26,75,1,1,0,4,69,4.8533333333333335,TP. Hồ Chí Minh,2023-11-24
23083757597,238618977,ICON DENIM ,Áo Thun Nam ICONDENIM Regular Do It Silently ATID0270,VND,15,2023-07-19,5,6,100011,,289000,289000,289000,320000,320000,10,1,0,0,0,0,1,5.0,TP. Hồ Chí Minh,2023-11-24
23884144641,238618977,ICON DENIM ,Áo Thun Unisex ICONDENIM Play Fun 4 All -  4th Anniversary 240 GSM ATID0294,VND,72,2023-07-19,9,3,100011,,289000,289000,289000,320000,320000,10,3,0,0,0,0,3,5.0,TP. Hồ Chí Minh,2023-11-24
20392841913,238618977,ICON DENIM ,Quần Jeans Nam ICONDENIM Skinny Dark Blue Wash QJID0144,VND,22,2023-07-19,10,3,100011,,399000,399000,399000,550000,550000,27,3,0,0,0,0,3,5.0,TP. Hồ Chí Minh,2023-11-24
7558579176,238618977,ICON DENIM ,Quần Short Nam Thể Thao ICONDENIM Signature In Black QSEC0006,VND,65,2023-07-19,286,299,100011,ICON DENIM,229000,229000,229000,250000,250000,8,80,2,1,4,6,67,4.6875,TP. Hồ Chí Minh,2023-11-24
23384451634,238618977,ICON DENIM ,Quần Short Pique ICONDENIM Regular Decup Combination QSID0143,VND,167,2023-07-19,28,4,100011,,269000,269000,269000,300000,300000,10,4,0,0,0,0,4,5.0,TP. Hồ Chí Minh,2023-11-24
18892852905,238618977,ICON DENIM ,Quần Jeans Nam ICONDENIM Skinny Classic Blue Wash QJID0145,VND,95,2023-07-19,18,3,100011,,399000,399000,399000,550000,550000,27,12,0,0,0,0,12,5.0,TP. Hồ Chí Minh,2023-11-24
19194462511,238618977,ICON DENIM ,Áo Thun Nam ICONDENIM 4 Years Of Adventure - 4th Anniversary 240GSM ATID0293,VND,89,2023-07-19,7,2,100011,,289000,289000,289000,320000,320000,10,1,0,0,0,0,1,5.0,TP. Hồ Chí Minh,2023-11-24
21493249962,238618977,ICON DENIM ,Áo Khoác Nhung Tăm ICONDENIM Black Wash AKID0068,VND,12,2023-07-19,10,2,100011,,439000,439000,439000,580000,580000,24,1,0,0,0,1,0,4.0,TP. Hồ Chí Minh,2023-11-24
22324921280,238618977,ICON DENIM ,Áo Thun Unisex Cổ Tròn ICONDENIM Form Dày Dặn Go Ahead ATID0196,VND,7,2023-07-19,50,6,100011,,269000,269000,269000,300000,300000,10,14,0,0,0,2,12,4.857142857142857,TP. Hồ Chí Minh,2023-11-24
22254138903,238618977,ICON DENIM ,Áo Khoác Bomber Varsity Contrast Sleeves AKID0080,VND,28,2023-07-20,5,7,100011,,459000,459000,459000,680000,680000,33,1,0,0,0,0,1,5.0,TP. Hồ Chí Minh,2023-11-24
23775682439,238618977,ICON DENIM ,Áo Sơmi Nam Tay Ngắn ICONDENIM Floral Brush Pattern SMID0129,VND,1,2023-07-20,51,43,100011,,299000,299000,299000,330000,330000,9,10,0,0,0,1,9,4.9,TP. Hồ Chí Minh,2023-11-24
20743606449,238618977,ICON DENIM ,Áo Sơmi Nam Trơn Tay Dài ICONDENIM Slim Fit Silkly Thanh Lịch SMID0075,VND,172,2023-07-20,724,198,100011,,249000,249000,249000,330000,330000,25,186,3,0,5,11,167,4.82258064516129,TP. Hồ Chí Minh,2023-11-24
19393251829,238618977,ICON DENIM ,Áo Khoác Nam Spray Paint AKID0096,VND,2,2023-07-21,7,2,100011,,289000,289000,289000,480000,480000,40,3,0,0,0,0,3,5.0,TP. Hồ Chí Minh,2023-11-24
23949827161,238618977,ICON DENIM ,Quần Tây Nam ICONDENIM Gentlemen Palette Slim Fit QTID0032,VND,22,2023-07-24,40,16,100011,,349000,349000,349000,380000,380000,8,11,0,0,0,1,10,4.909090909090909,TP. Hồ Chí Minh,2023-11-24
19159816827,238618977,ICON DENIM ,Áo Khoác Nam Flannel ICON DENIM Regular Form Caro Nâu AKID0056,VND,13,2023-07-24,33,148,100011,,409000,409000,409000,650000,650000,37,9,0,0,1,0,8,4.777777777777778,TP. Hồ Chí Minh,2023-11-24
18591583811,238618977,ICON DENIM ,Áo Thun Unisex ICONDENIM Make Your Own Trail 260gsm ATID0258,VND,5,2023-07-24,28,8,100011,,269000,269000,269000,290000,290000,7,4,0,0,0,0,4,5.0,TP. Hồ Chí Minh,2023-11-24
22781136983,238618977,ICON DENIM ,Áo Tanktop Nam ICONDENIM Slimfit Basic Extra-Cool TTID0015,VND,260,2023-07-24,63,17,100011,,139000,139000,139000,190000,190000,27,12,0,0,1,1,10,4.75,TP. Hồ Chí Minh,2023-11-24
23850022266,238618977,ICON DENIM ,Quần Jeans Nam ICONDENIM Slim Fit Dark Blue QJID0135,VND,32,2023-07-24,33,5,100011,,499000,499000,499000,550000,550000,9,12,0,0,0,1,11,4.916666666666667,TP. Hồ Chí Minh,2023-11-24
23750845230,238618977,ICON DENIM ,Quần Short Jeans Nam ICONDENIM Lưng Thun Phối Rập QSID0069,VND,25,2023-07-24,12,3,100011,,309000,309000,309000,330000,330000,6,5,1,0,0,0,4,4.2,TP. Hồ Chí Minh,2023-11-24
23758234809,238618977,ICON DENIM ,Set Đồ ICONDENIM Cozy Green And White SEID0020,VND,28,2023-07-24,12,9,100011,,259000,259000,289000,290000,320000,11,2,0,0,0,0,2,5.0,TP. Hồ Chí Minh,2023-11-24
18191716218,238618977,ICON DENIM ,Quần Jeans Nam Skinny ICONDENIM Wash W Orgnls Embroider QJID0139,VND,23,2023-07-24,2,0,100011,,489000,489000,489000,550000,550000,11,1,0,0,0,0,1,5.0,TP. Hồ Chí Minh,2023-11-24
17698784519,238618977,ICON DENIM ,Quần Jeans Nam Skinny ICONDENIM Retro Streetstyle QJID0150,VND,30,2023-07-24,19,10,100011,,399000,399000,399000,550000,550000,27,10,0,0,0,0,10,5.0,TP. Hồ Chí Minh,2023-11-24
23355727328,238618977,ICON DENIM ,Áo Thun Nam ICONDENIM The Inspiration Of Flowers ATID0252,VND,46,2023-07-24,26,3,100011,,269000,269000,269000,300000,300000,10,9,0,0,0,0,9,5.0,TP. Hồ Chí Minh,2023-11-24
15998119787,238618977,ICON DENIM ,Áo Khoác Chagi Waterproof AKID0099,VND,11,2023-07-24,21,53,100011,,429000,429000,429000,480000,480000,11,5,0,0,0,0,5,5.0,TP. Hồ Chí Minh,2023-11-24
16898300844,238618977,ICON DENIM ,Áo Sơmi Caro Tay Dài SMID0065,VND,7,2023-07-24,22,11,100011,,159000,159000,159000,300000,300000,47,9,0,0,1,0,8,4.777777777777778,TP. Hồ Chí Minh,2023-11-24
9583542337,238618977,ICON DENIM ,Áo Sơ Mi Nam ICON DENIM Tay Dài Công Sở Dáng Ôm Form Slimfit Silky Soft Trơn Vải Lụa Không Nhăn SMID0046,VND,2,2023-07-24,831,381,100011,,219000,219000,219000,350000,350000,37,258,6,4,5,15,228,4.763565891472868,TP. Hồ Chí Minh,2023-11-24
23054144943,238618977,ICON DENIM ,Áo Khoác Collared Jacket Logo Printed AKID0114,VND,88,2023-07-24,9,9,100011,,399000,399000,399000,450000,450000,11,3,0,0,0,0,3,5.0,TP. Hồ Chí Minh,2023-11-24
13699041925,238618977,ICON DENIM ,Áo Khoác Bomber Utility Flight,VND,22,2023-07-25,29,24,100011,,329000,329000,329000,450000,450000,27,7,0,0,0,0,7,5.0,TP. Hồ Chí Minh,2023-11-24
15599501179,238618977,ICON DENIM ,Áo Khoác Nam Grey ICONDENIM Logo Pattern AKID0107,VND,48,2023-07-25,2,2,100011,,429000,429000,429000,480000,480000,11,0,0,0,0,0,0,0.0,TP. Hồ Chí Minh,2023-11-24
18543896915,238618977,ICON DENIM ,Áo Polo Nam Cotton ICONDENIM Regular Navy Phối Sọc Thanh Lịch PLID0014,VND,158,2023-07-25,81,28,100011,,239000,239000,239000,350000,350000,32,26,0,0,1,2,23,4.846153846153846,TP. Hồ Chí Minh,2023-11-24
23149902620,238618977,ICON DENIM ,Túi Đeo Chéo ICONDENIM Mini Reporter ORGNLS TUID0018,VND,7,2023-07-25,6,6,100533,,449000,449000,449000,550000,550000,18,2,0,0,0,0,2,5.0,TP. Hồ Chí Minh,2023-11-24
17899322680,238618977,ICON DENIM ,Quần Short Jeans Nam ICONDENIM Cargo Garment Washing QSID0149,VND,23,2023-07-25,3,3,100011,,379000,379000,379000,420000,420000,10,1,0,0,0,0,1,5.0,TP. Hồ Chí Minh,2023-11-24
22149922519,238618977,ICON DENIM ,Quần Short Jeans Nam ICONDENIM Slim Torned Blue Wash QSID0122,VND,11,2023-07-25,11,3,100011,,319000,319000,319000,350000,350000,9,4,0,0,0,0,4,5.0,TP. Hồ Chí Minh,2023-11-24
18482786183,238618977,ICON DENIM ,Balo Classic ICONDENIM Water-Proof BIID0002,VND,29,2023-07-25,1,1,100533,,640000,640000,640000,800000,800000,20,0,0,0,0,0,0,0.0,TP. Hồ Chí Minh,2023-11-24
22649826707,238618977,ICON DENIM ,Quần Tây Nam Skinny ICONDENIM Lưng Phối Thun QTID0031,VND,40,2023-07-25,29,5,100011,,349000,349000,349000,380000,380000,8,8,1,0,0,0,7,4.5,TP. Hồ Chí Minh,2023-11-24
23050013590,238618977,ICON DENIM ,Quần Jogger Denim Wash ICONDENIM Basic Slim JGID0039,VND,34,2023-07-25,13,4,100011,,439000,439000,439000,480000,480000,9,5,0,0,0,0,5,5.0,TP. Hồ Chí Minh,2023-11-24
22355624693,238618977,ICON DENIM ,Quần Jeans Nam ICONDENIM Straight Label Weaving QJID0152,VND,2,2023-07-25,8,6,100011,,499000,499000,499000,550000,550000,9,2,0,0,0,0,2,5.0,TP. Hồ Chí Minh,2023-11-24
21949859775,238618977,ICON DENIM ,Áo Thun Polo Nam Tay Ngắn ICONDENIM Cotton Crazy Bear Form Slim PLID0049,VND,8,2023-07-25,55,32,100011,,219000,219000,219000,350000,350000,37,15,0,0,0,2,13,4.866666666666666,TP. Hồ Chí Minh,2023-11-24
22375689754,238618977,ICON DENIM ,Quần Short Nỉ Nam Basic ICONDENIM Logo Embroider QSID0121,VND,19,2023-07-26,60,12,100011,,259000,259000,259000,280000,280000,8,12,0,0,0,0,12,5.0,TP. Hồ Chí Minh,2023-11-24
21791389343,238618977,ICON DENIM ,Quần Short Nỉ Nam Pique ICONDENIM QSID0132,VND,52,2023-07-26,35,4,100011,,269000,269000,269000,300000,300000,10,10,0,0,0,0,10,5.0,TP. Hồ Chí Minh,2023-11-24
8358832674,238618977,ICON DENIM ,Áo Thun Nam Cotton ICONDENIM Regular The Dogfather Cool Ngầu ATID0075,VND,57,2023-07-26,278,154,100011,,219000,219000,219000,300000,300000,27,97,2,0,4,5,86,4.783505154639175,TP. Hồ Chí Minh,2023-11-24
22658241115,238618977,ICON DENIM ,Áo Polo Nam ICONDENIM Pattern Tex PLID0090,VND,40,2023-07-26,7,2,100011,,319000,319000,319000,350000,350000,9,1,0,1,0,0,0,2.0,TP. Hồ Chí Minh,2023-11-24
22384435045,238618977,ICON DENIM ,Áo Thun Unisex ICONDENIM Regular Bobmarley ATID0263,VND,25,2023-07-26,8,4,100011,,269000,269000,269000,300000,300000,10,2,0,0,0,0,2,5.0,TP. Hồ Chí Minh,2023-11-24
20392844341,238618977,ICON DENIM ,Quần Jeans Nam ICONDENIM Skinny Sharp Wash QJID0146,VND,32,2023-07-26,4,0,100011,,399000,399000,399000,550000,550000,27,3,0,0,0,0,3,5.0,TP. Hồ Chí Minh,2023-11-24
23712631573,238618977,ICON DENIM ,Quần Jeans Nam ICONDENIM Smart Jeans Form Smart Fit Blue QJID0116,VND,82,2023-07-27,171,46,100011,,499000,499000,499000,590000,590000,15,51,0,1,0,0,50,4.9411764705882355,TP. Hồ Chí Minh,2023-11-24
19591725259,238618977,ICON DENIM ,Mắt Kinh ICONDENIM Cat-Eye In Black & Yellow KIID0010,VND,8,2023-07-27,7,4,100009,,349000,349000,349000,380000,380000,8,2,0,0,0,0,2,5.0,TP. Hồ Chí Minh,2023-11-24
23018767453,238618977,ICON DENIM ,Quần Jeans Nam Trơn ICONDENIM Slim Fit Blue Wash QJID0096,VND,4,2023-07-27,95,32,100011,,399000,399000,550000,550000,550000,27,35,0,0,0,4,31,4.885714285714286,TP. Hồ Chí Minh,2023-11-24
20384179010,238618977,ICON DENIM ,Áo Khoác Dù WindJacket ICONDENIM Lightweight AKID0082,VND,3,2023-07-27,12,9,100011,,399000,399000,399000,530000,530000,25,2,0,0,0,0,2,5.0,TP. Hồ Chí Minh,2023-11-24
22054139279,238618977,ICON DENIM ,Áo Thun ICONDENIM Alphabet Street Style ATID0228,VND,10,2023-07-28,9,5,100011,,259000,259000,259000,300000,300000,14,3,0,0,0,0,3,5.0,TP. Hồ Chí Minh,2023-11-24
17199321488,238618977,ICON DENIM ,Áo Polo Nam ICONDENIM Milk Coffee Striped PLID0082,VND,4,2023-07-28,6,1,100011,,319000,319000,319000,350000,350000,9,0,0,0,0,0,0,0.0,TP. Hồ Chí Minh,2023-11-24
21793130917,238618977,ICON DENIM ,Áo Khoác ICONDENIM Dark & Light AKID0108,VND,17,2023-07-28,2,1,100011,,399000,399000,399000,450000,450000,11,1,1,0,0,0,0,1.0,TP. Hồ Chí Minh,2023-11-24
13023544510,238618977,ICON DENIM ,Áo Thun Nam Trắng Cổ Tròn ICONDENIM Premium Single Blood Sweat & Tears ATEC0009,VND,1,2023-07-28,571,448,100011,,289000,289000,289000,350000,350000,17,212,1,1,1,7,202,4.9245283018867925,TP. Hồ Chí Minh,2023-11-24
23784143175,238618977,ICON DENIM ,Áo Thun Unisex ICONDENIM Domino Four - 4th Anniversary 240GSM ATID0291,VND,54,2023-07-28,8,1,100011,,289000,289000,289000,320000,320000,10,1,0,0,0,0,1,5.0,TP. Hồ Chí Minh,2023-11-24
23175415651,238618977,ICON DENIM ,Quần Kaki Nam Technical Fabric ICONDENIM Phối Lưng Thun QKID0016,VND,8,2023-07-29,32,6,100011,,289000,289000,319000,400000,400000,28,11,0,0,0,0,11,5.0,TP. Hồ Chí Minh,2023-11-24
20692881245,238618977,ICON DENIM ,Áo Thun ICONDENIM Cowboy West ATID0229,VND,10,2023-07-29,5,1,100011,,259000,259000,259000,300000,300000,14,2,0,0,0,0,2,5.0,TP. Hồ Chí Minh,2023-11-24
23376329711,238618977,ICON DENIM ,Túi Đeo Chéo Da ICONDENIM 2 Sọc TUID0015,VND,38,2023-07-29,4,4,100533,,499000,499000,499000,580000,580000,14,3,0,0,0,0,3,5.0,TP. Hồ Chí Minh,2023-11-24
22254042035,238618977,ICON DENIM ,Quần Jeans Nam ICONDENIM Skinny Blue Heavy Rips QJID0109,VND,37,2023-07-29,2,0,100011,,419000,419000,419000,550000,550000,24,1,0,0,0,0,1,5.0,TP. Hồ Chí Minh,2023-11-24
19383871464,238618977,ICON DENIM ,Quần Jeans Skinny Blue Wash W Rips QJID0132,VND,34,2023-07-29,8,0,100011,,419000,419000,419000,550000,550000,24,2,0,0,0,1,1,4.5,TP. Hồ Chí Minh,2023-11-24
22484453108,238618977,ICON DENIM ,Túi Đeo Chéo ICONDENIM Landscape Crossbody TUID0024,VND,39,2023-07-30,3,2,100533,,259000,259000,259000,290000,290000,11,0,0,0,0,0,0,0.0,TP. Hồ Chí Minh,2023-11-24
14597927770,238618977,ICON DENIM ,Quần Jeans Skinny Nam ICONDENIM Blue Wash Heavy Rips QJDI0129,VND,3,2023-07-30,3,1,100011,,489000,489000,489000,550000,550000,11,0,0,0,0,0,0,0.0,TP. Hồ Chí Minh,2023-11-24
9919424859,238618977,ICON DENIM ,Áo Thun Polo Nam Trơn ICONDENIM Basic Slim Fit Thêu Logo Signature PLEC0004,VND,42,2023-07-30,685,298,100011,ICON DENIM,259000,259000,259000,420000,420000,38,190,2,2,6,7,173,4.826315789473684,TP. Hồ Chí Minh,2023-11-24
14997937791,238618977,ICON DENIM ,Balo Da ICONDENIM Classic In Black BLID0004,VND,4,2023-07-30,0,4,100533,,680000,680000,680000,850000,850000,20,0,0,0,0,0,0,0.0,TP. Hồ Chí Minh,2023-11-24
19385619810,238618977,ICON DENIM ,Áo Thun Nam ICONDENIM Embroider Letters ATID0241,VND,43,2023-07-30,2,0,100011,,249000,249000,249000,280000,280000,11,1,0,0,0,0,1,5.0,TP. Hồ Chí Minh,2023-11-24
22058929837,238618977,ICON DENIM ,Quần Short Jeans ICONDENIM Bandana Pattern Light Blue QSID0120,VND,63,2023-07-30,1,1,100011,,349000,349000,349000,390000,390000,11,0,0,0,0,0,0,0.0,TP. Hồ Chí Minh,2023-11-24
19782448309,238618977,ICON DENIM ,Quần Kaki Nam ICONDENIM Slim-Fit Smart Basic QKID0023,VND,33,2023-07-30,23,9,100011,,359000,359000,359000,400000,400000,10,8,0,0,0,1,7,4.875,TP. Hồ Chí Minh,2023-11-24
7245415641,238618977,ICON DENIM ,Quần Short Nỉ Nam ICONDENIM Essentials QSID0066,VND,20,2023-07-30,152,50,100011,ICON DENIM,259000,259000,259000,350000,350000,26,40,0,1,1,1,37,4.85,TP. Hồ Chí Minh,2023-11-24
15398193828,238618977,ICON DENIM ,Áo Thun Special Quotes ICONDENIM Orgnls ATID0268,VND,63,2023-07-30,6,3,100011,,249000,249000,249000,280000,280000,11,1,0,0,0,0,1,5.0,TP. Hồ Chí Minh,2023-11-24
22681217713,238618977,ICON DENIM ,Áo Polo Nam ICONDENIM Regular Horizonal Stripes PLID0103,VND,27,2023-07-30,6,0,100011,,319000,319000,319000,350000,350000,9,0,0,0,0,0,0,0.0,TP. Hồ Chí Minh,2023-11-24
19157655389,238618977,ICON DENIM ,Áo Thun Nam Cổ Tròn Cotton 2 Chiều Thoáng Mát ICONDENIM Regular Form Parrot Printed ATID0161,VND,1,2023-07-31,153,48,100011,,179000,179000,179000,280000,280000,36,43,0,1,1,2,39,4.837209302325581,TP. Hồ Chí Minh,2023-11-24
