item_id,shop_id,shop_name,name,currency,stock,ctime,historical_sold,liked_count,cat_id,brand,price,price_min,price_max,price_min_before_discount,price_max_before_discount,raw_discount,rating_total,rating_1_star,rating_2_star,rating_3_star,rating_4_star,rating_5_star,rating_star,shop_location,crawl_date
22138126570,108136164,Thời Trang KHATOCO,Quần lót boxer nam Khatoco màu xanh đậm mã Q5M085R0-VNMA038-2307-B,VND,82,2023-02-19,2,0,100011,,72250,72250,72250,85000,85000,15,0,0,0,0,0,0,0.0,Khánh Hòa,2023-11-24
22138126563,108136164,Thời Trang KHATOCO,Quần lót nam Khatoco sọc xanh đen mã Q4M118R0-VNSC003-2411-T,VND,77,2023-02-19,0,0,100011,,82600,82600,82600,118000,118000,30,0,0,0,0,0,0,0.0,Khánh Hòa,2023-11-24
21931660515,108136164,Thời Trang KHATOCO,Áo sơ mi nam tay ngắn Khatoco họa tiết xanh đậm mã A1MN438T2-CNCR175-2305-N,VND,10,2023-02-19,1,1,100011,,350400,350400,372300,438000,438000,20,0,0,0,0,0,0,0.0,Khánh Hòa,2023-11-24
21590409219,108136164,Thời Trang KHATOCO,Áo sơ mi nam tay ngắn Khatoco họa tiết xám mã A1MN538T2-CNIN323-2504-N,VND,13,2023-02-19,0,0,100011,,538000,538000,538000,-1,-1,0,0,0,0,0,0,0,0.0,Khánh Hòa,2023-11-24
22237923613,108136164,Thời Trang KHATOCO,Áo sơ mi nam tay dài Khatoco caro xanh mã A1MD468T1-CNCR232-2411-D,VND,7,2023-02-19,0,0,100011,,397800,397800,397800,468000,468000,15,0,0,0,0,0,0,0.0,Khánh Hòa,2023-11-24
22237923615,108136164,Thời Trang KHATOCO,Áo sơ mi nam tay dài Khatoco xanh caro mã A1MD498T1-CNCR089-2409-D,VND,38,2023-02-19,0,0,100011,,423300,423300,423300,498000,498000,15,0,0,0,0,0,0,0.0,Khánh Hòa,2023-11-24
22237923622,108136164,Thời Trang KHATOCO,Áo sơ mi nam Khatoco kẻ sọc màu tím tay dài A1MD468T1-THSC004-2111-D,VND,62,2023-02-20,0,0,100011,,351000,351000,351000,468000,468000,25,0,0,0,0,0,0,0.0,Khánh Hòa,2023-11-24
22237923661,108136164,Thời Trang KHATOCO,Áo sơ mi nam tay dài Khatoco họa tiết xanh mã A1MD498T1-CNIN187-2411-D,VND,1,2023-02-20,0,0,100011,,498000,498000,498000,-1,-1,0,0,0,0,0,0,0,0.0,Khánh Hòa,2023-11-24
22247113349,108136164,Thời Trang KHATOCO,Áo sơ mi nam tay ngắn Khatoco caro xanh mã A1MN468T2-CNCR181-2411-N,VND,1,2023-02-20,0,0,100011,,468000,468000,468000,-1,-1,0,0,0,0,0,0,0,0.0,Khánh Hòa,2023-11-24
22338106589,108136164,Thời Trang KHATOCO,Quần lót boxer nam Khatoco màu xanh đậm mã Q5M085R0-VNMA016-2307-B,VND,36,2023-02-20,2,0,100011,,68000,68000,68000,85000,85000,20,0,0,0,0,0,0,0.0,Khánh Hòa,2023-11-24
22511555683,108136164,Thời Trang KHATOCO,Áo thun lót nam Khatoco màu trơn xám đậm mã A4MN170R2-VNMA002-2407-N,VND,18,2023-02-20,0,0,100011,,136000,136000,136000,170000,170000,20,0,0,0,0,0,0,0.0,Khánh Hòa,2023-11-24
22538846634,108136164,Thời Trang KHATOCO,Áo thun lót nam Khatoco màu trơn xám mã A4MN170R2-VNMA001-2407-N,VND,10,2023-02-20,0,0,100011,,136000,136000,136000,170000,170000,20,0,0,0,0,0,0,0.0,Khánh Hòa,2023-11-24
20678188061,108136164,Thời Trang KHATOCO,Áo sơ mi nam tay ngắn Khatoco họa tiết xanh rêu mã A1MN568T2-ININ008-2102-N,VND,27,2023-02-20,0,0,100011,,397600,397600,397600,568000,568000,30,0,0,0,0,0,0,0.0,Khánh Hòa,2023-11-24
21068827384,108136164,Thời Trang KHATOCO,Áo thun lót nam Khatoco màu trơn xám đậm mã A4MN170R2-VNMA002-2407-N,VND,18,2023-02-20,0,0,100011,,136000,136000,136000,170000,170000,20,0,0,0,0,0,0,0.0,Khánh Hòa,2023-11-24
21378149376,108136164,Thời Trang KHATOCO,Áo sơ mi nam tay dài Khatoco caro xanh mã A1MD468T1-CNCR103-2409-D,VND,38,2023-02-21,0,0,100011,,397800,397800,397800,468000,468000,15,0,0,0,0,0,0,0.0,Khánh Hòa,2023-11-24
21566862599,108136164,Thời Trang KHATOCO,Áo sơ mi nam tay ngắn Khatoco họa tiết mã A1MN388T2-ININ024-2307-N,VND,38,2023-02-21,0,0,100011,,329800,329800,329800,388000,388000,15,0,0,0,0,0,0,0.0,Khánh Hòa,2023-11-24
21590409216,108136164,Thời Trang KHATOCO,Áo sơ mi nam tay dài Khatoco caro xanh mã A1MD468T1-CNCR109-2409-D,VND,7,2023-02-21,0,0,100011,,397800,397800,397800,468000,468000,15,0,0,0,0,0,0,0.0,Khánh Hòa,2023-11-24
23938047682,108136164,Thời Trang KHATOCO,Áo sơ mi nam Khatoco tay ngắn màu xanh coban họa tiết đan xen mã A1MN538T2-CNMK002-2202-N,VND,46,2023-02-21,1,1,100011,,403500,403500,403500,538000,538000,25,0,0,0,0,0,0,0.0,Khánh Hòa,2023-11-24
23638126844,108136164,Thời Trang KHATOCO,Quần lót nam boxer Khatoco màu trơn xám đậm mã Q5M108R0-VNMA052-2411-B,VND,1,2023-02-21,0,0,100011,,86400,86400,86400,108000,108000,20,0,0,0,0,0,0,0.0,Khánh Hòa,2023-11-24
23711568926,108136164,Thời Trang KHATOCO,Áo thun lót nam Khatoco màu trơn xanh mã A4MN170R2-VNMA004-2407-N,VND,18,2023-02-21,0,0,100011,,136000,136000,153000,170000,170000,20,0,0,0,0,0,0,0.0,Khánh Hòa,2023-11-24
23909452249,108136164,Thời Trang KHATOCO,Áo thun polo nam Khatoco họa tiết xanh mã A2MN398R2-CNMK031-2407-N,VND,69,2023-02-22,1,1,100011,,358200,358200,358200,398000,398000,10,0,0,0,0,0,0,0.0,Khánh Hòa,2023-11-24
16696044438,108136164,Thời Trang KHATOCO,Áo sơ mi nam tay dài Khatoco caro xanh mã A1MD468T1-CNCR034-2407-D,VND,51,2023-02-22,0,0,100011,,397800,397800,397800,468000,468000,15,0,0,0,0,0,0,0.0,Khánh Hòa,2023-11-24
22638042210,108136164,Thời Trang KHATOCO,Áo sơ mi nam Khatoco tay ngắn họa tiết màu xanh đậm mã A1MN438T2-CNIN012-2106-N,VND,93,2023-02-22,0,0,100011,,306600,306600,306600,438000,438000,30,0,0,0,0,0,0,0.0,Khánh Hòa,2023-11-24
22638042212,108136164,Thời Trang KHATOCO,Áo sơ mi nam tay dài Khatoco caro xanh đậm mã A1MD468T1-CNCR102-2409-D,VND,16,2023-02-22,0,0,100011,,397800,397800,397800,468000,468000,15,0,0,0,0,0,0,0.0,Khánh Hòa,2023-11-24
22837927263,108136164,Thời Trang KHATOCO,Áo sơ mi nam Khatoco tay dài màu xanh da trời kẻ caro trắng mã A1MD468T1-CNCR104-2112-D,VND,6,2023-02-23,0,0,100011,,327600,327600,327600,468000,468000,30,0,0,0,0,0,0,0.0,Khánh Hòa,2023-11-24
22837927264,108136164,Thời Trang KHATOCO,Áo sơ mi nam tay dài Khatoco caro xanh rêu mã A1MD398T1-CNCR054-2207-D,VND,6,2023-02-23,0,0,100011,,338300,338300,338300,398000,398000,15,0,0,0,0,0,0,0.0,Khánh Hòa,2023-11-24
22838119738,108136164,Thời Trang KHATOCO,Quần lót nam boxer Khatoco sọc xám mã Q5M128R0-VNSC004-2411-B,VND,4,2023-02-23,0,0,100011,,102400,102400,102400,128000,128000,20,0,0,0,0,0,0,0.0,Khánh Hòa,2023-11-24
22838124749,108136164,Thời Trang KHATOCO,Quần lót nam Khatoco boxer màu xám mã Q5M108R0-VNMA037-2301-B,VND,13,2023-02-23,1,0,100011,,91800,91800,91800,108000,108000,15,0,0,0,0,0,0,0.0,Khánh Hòa,2023-11-24
22938048620,108136164,Thời Trang KHATOCO,Áo sơ mi nam Khatoco tay ngắn màu trắng họa tiết xanh tím mã A1MN468T2-CNIN049-2111-N,VND,72,2023-02-23,1,2,100011,,327600,327600,327600,468000,468000,30,0,0,0,0,0,0,0.0,Khánh Hòa,2023-11-24
23047111509,108136164,Thời Trang KHATOCO,Áo sơ mi nam tay dài Khatoco caro xanh mã A1MD468T1-CNCR043-2407-D,VND,30,2023-02-23,0,0,100011,,397800,397800,397800,468000,468000,15,0,0,0,0,0,0,0.0,Khánh Hòa,2023-11-24
23138047622,108136164,Thời Trang KHATOCO,Áo sơ mi nam Khatoco tay ngắn họa tiết màu xanh navy mã A1MN388T2-CNCR086-2112-N,VND,92,2023-02-23,0,0,100011,,271600,271600,271600,388000,388000,30,0,0,0,0,0,0,0.0,Khánh Hòa,2023-11-24
23138047684,108136164,Thời Trang KHATOCO,Áo sơ mi nam Khatoco tay ngắn họa tiết màu xanh mã A1MN388T2-ININ015A-2210-N,VND,36,2023-02-23,0,0,100011,,271600,271600,271600,388000,388000,30,0,0,0,0,0,0,0.0,Khánh Hòa,2023-11-24
22237923633,108136164,Thời Trang KHATOCO,Áo sơ mi nam Khatoco tay dài kẻ caro xám mã A1MD388T1-CNCR104-2210-D,VND,32,2023-02-23,0,0,100011,,388000,388000,388000,-1,-1,0,0,0,0,0,0,0,0.0,Khánh Hòa,2023-11-24
16594095209,108136164,Thời Trang KHATOCO,Áo sơ mi nam tay dài Khatoco caro xanh mã A1MD388T1-CNCR054-2110-D,VND,51,2023-02-23,0,0,100011,,388000,388000,388000,-1,-1,0,0,0,0,0,0,0,0.0,Khánh Hòa,2023-11-24
19231648788,108136164,Thời Trang KHATOCO,Áo sơ mi nam tay dài Khatoco caro xanh mã A1MD468T1-CNCR253-2307-D,VND,4,2023-02-23,0,0,100011,,468000,468000,468000,-1,-1,0,0,0,0,0,0,0,0.0,Khánh Hòa,2023-11-24
19704726347,108136164,Thời Trang KHATOCO,Áo sơ mi nam Khatoco dài tay kẻ caro xám trắng mã A1MD468T1-CNCR223-2307-D,VND,4,2023-02-23,1,0,100011,,468000,468000,468000,-1,-1,0,0,0,0,0,0,0,0.0,Khánh Hòa,2023-11-24
20510631322,108136164,Thời Trang KHATOCO,Áo sơ mi nam Khatoco ngắn tay kẻ caro màu xanh A1MN388T2-CNCR125-2301-N,VND,8,2023-02-23,2,0,100011,,388000,388000,388000,-1,-1,0,0,0,0,0,0,0,0.0,Khánh Hòa,2023-11-24
20837422617,108136164,Thời Trang KHATOCO,Áo sơ mi nam tay dài Khatoco sọc xanh trắng mã A1MD468T1-CNSC002-2406-D,VND,15,2023-02-23,1,0,100011,,468000,468000,468000,-1,-1,0,0,0,0,0,0,0,0.0,Khánh Hòa,2023-11-24
21304701778,108136164,Thời Trang KHATOCO,Áo sơ mi nam Khatoco dài tay kẻ caro xanh trắng mã A1MD468T1-CNCR195-2307-D,VND,6,2023-02-23,0,0,100011,,468000,468000,468000,-1,-1,0,0,0,0,0,0,0,0.0,Khánh Hòa,2023-11-24
21378149374,108136164,Thời Trang KHATOCO,Áo sơ mi nam Khatoco dài tay kẻ caro màu xanh đậm mã A1MD398T1-THCR003-2201-D,VND,11,2023-02-23,0,0,100011,,398000,398000,398000,-1,-1,0,0,0,0,0,0,0,0.0,Khánh Hòa,2023-11-24
16494095238,108136164,Thời Trang KHATOCO,Áo sơ mi nam Khatoco dài tay kẻ caro màu xanh mã A1MD468T1-CNCR012-2004-D,VND,6,2023-02-23,0,0,100011,,468000,468000,468000,-1,-1,0,0,0,0,0,0,0,0.0,Khánh Hòa,2023-11-24
22237923645,108136164,Thời Trang KHATOCO,Áo sơ mi nam tay dài Khatoco họa tiết xanh mã A1MD388T1-CNMK015-2110-D,VND,22,2023-02-23,0,0,100011,,388000,388000,388000,-1,-1,0,0,0,0,0,0,0,0.0,Khánh Hòa,2023-11-24
22453784194,108136164,Thời Trang KHATOCO,Áo sơ mi nam tay dài Khatoco màu be mã A1MD498T1-CNIN281-2502-D,VND,1,2023-02-23,0,0,100011,,423300,423300,423300,498000,498000,15,0,0,0,0,0,0,0.0,Khánh Hòa,2023-11-24
1764938699,108136164,Thời Trang KHATOCO,Áo thun nam màu xám Khatoco A3MN140R2-VNMA028-2010-N,VND,55,2023-02-23,8,1,100011,,119000,119000,119000,140000,140000,15,0,0,0,0,0,0,0.0,Khánh Hòa,2023-11-24
5545966582,108136164,Thời Trang KHATOCO,Áo sơ mi nam tay ngắn kẻ caro Khatoco mã A1MN468T2-CNCR083-2112-N,VND,12,2023-02-23,4,1,100011,KHATOCO,321300,321300,321300,468000,468000,31,0,0,0,0,0,0,0.0,Khánh Hòa,2023-11-24
8723443565,108136164,Thời Trang KHATOCO,Áo sơ mi nam tay dài Khatoco màu xanh nhạt mã A1MD398T1-CNCR094-2209-D,VND,9,2023-02-23,0,0,100011,KHATOCO,376600,376600,376600,398000,398000,5,0,0,0,0,0,0,0.0,Khánh Hòa,2023-11-24
5045983335,108136164,Thời Trang KHATOCO,Áo sơ mi nam tay dài kẻ caro Khatoco mã A1MD468T1-THCR006-2112-D,VND,44,2023-02-23,1,1,100011,KHATOCO,468000,468000,468000,-1,-1,0,0,0,0,0,0,0,0.0,Khánh Hòa,2023-11-24
5782393997,108136164,Thời Trang KHATOCO,Áo sơ mi nam tay dài kẻ caro Khatoco mã A1MD498T1-CNCR088-2112-D,VND,5,2023-02-24,1,0,100011,KHATOCO,468000,468000,468000,-1,-1,0,1,0,0,0,0,1,5.0,Khánh Hòa,2023-11-24
6245982776,108136164,Thời Trang KHATOCO,Áo sơ mi nam tay ngắn kẻ caro Khatoco mã A1MN468T2-CNCR100-2112-N,VND,34,2023-02-24,0,2,100011,KHATOCO,468000,468000,468000,-1,-1,0,0,0,0,0,0,0,0.0,Khánh Hòa,2023-11-24
6968849301,108136164,Thời Trang KHATOCO,Áo sơ mi nam Khatoco dài tay kẻ caro màu xanh mã A1MD398T1-CNCR087-2209-D,VND,15,2023-02-24,0,0,100011,KHATOCO,398000,398000,398000,-1,-1,0,0,0,0,0,0,0,0.0,Khánh Hòa,2023-11-24
7345865878,108136164,Thời Trang KHATOCO,Áo sơ mi nam tay dài kẻ caro Khatoco mã A1MD498T1-CNCR091-2112-D,VND,7,2023-02-24,0,0,100011,KHATOCO,498000,498000,498000,-1,-1,0,0,0,0,0,0,0,0.0,Khánh Hòa,2023-11-24
7850202978,108136164,Thời Trang KHATOCO,Áo sơ mi nam tay dài Khatoco xanh họa tiết chấm bi mã A1MD468T1-CNMK037-2112-D,VND,18,2023-02-24,0,0,100011,KHATOCO,468000,468000,468000,-1,-1,0,0,0,0,0,0,0,0.0,Khánh Hòa,2023-11-24
8827924402,108136164,Thời Trang KHATOCO,Áo sơ mi nam tay dài kẻ sọc Khatoco mã A1MD468T1-CNSC030-2112-D,VND,23,2023-02-24,0,0,100011,KHATOCO,468000,468000,468000,-1,-1,0,0,0,0,0,0,0,0.0,Khánh Hòa,2023-11-24
9203195028,108136164,Thời Trang KHATOCO,Áo sơ mi nam Khatoco tay dài họa tiết màu xanh mã A1MD468T1-CNMK017-2204-D,VND,20,2023-02-24,1,0,100011,KHATOCO,468000,468000,468000,-1,-1,0,0,0,0,0,0,0,0.0,Khánh Hòa,2023-11-24
9423468668,108136164,Thời Trang KHATOCO,Áo sơ mi nam tay ngắn kẻ caro Khatoco mã A1MN388T2-CNCR066-2209-N,VND,13,2023-02-24,5,0,100011,KHATOCO,388000,388000,388000,-1,-1,0,2,0,0,0,0,2,5.0,Khánh Hòa,2023-11-24
9523295032,108136164,Thời Trang KHATOCO,Quần lót nam Khatoco màu xanh đậm mã Q4M075R0-VNMA014-2112-T,VND,6,2023-02-24,9,0,100011,Khatoco,75000,75000,75000,-1,-1,0,6,0,0,0,0,6,5.0,Khánh Hòa,2023-11-24
9803190658,108136164,Thời Trang KHATOCO,Áo sơ mi nam Khatoco dài tay kẻ caro mã A1MD468T1-CNCR015-2202-D,VND,42,2023-02-24,0,1,100011,KHATOCO,468000,468000,468000,-1,-1,0,0,0,0,0,0,0,0.0,Khánh Hòa,2023-11-24
10206589704,108136164,Thời Trang KHATOCO,Áo sơ mi nam tay ngắn màu xanh lam kẻ caro xanh đậm Khatoco mã A1MN388T2-CNCR036-2204-N,VND,20,2023-02-24,13,0,100011,,388000,388000,388000,-1,-1,0,7,0,0,0,0,7,5.0,Khánh Hòa,2023-11-24
10315706889,108136164,Thời Trang KHATOCO,Áo sơ mi nam Khatoco ngắn tay kẻ caro mã A1MN388T2-CNCR114-2212-N,VND,34,2023-02-24,12,0,100011,,388000,388000,388000,-1,-1,0,6,0,0,0,1,5,4.833333333333333,Khánh Hòa,2023-11-24
11187194032,108136164,Thời Trang KHATOCO,Áo sơ mi nam tay ngắn kẻ caro Khatoco mã A1MN388T2-CNCR085-2209-N,VND,40,2023-02-24,0,0,100011,,388000,388000,388000,-1,-1,0,0,0,0,0,0,0,0.0,Khánh Hòa,2023-11-24
15491936889,108136164,Thời Trang KHATOCO,Áo sơ mi nam tay ngắn Khatoco kẻ caro mã A1MN538T2-CNCR167-2305-N,VND,15,2023-02-24,1,0,100011,,538000,538000,538000,-1,-1,0,1,0,0,0,1,0,4.0,Khánh Hòa,2023-11-24
16494095237,108136164,Thời Trang KHATOCO,Áo sơ mi nam Khatoco tay dài kẻ caro màu trắng xanh mã A1MD398T1-CNCR093-2209-D,VND,24,2023-02-24,0,1,100011,,398000,398000,398000,-1,-1,0,0,0,0,0,0,0,0.0,Khánh Hòa,2023-11-24
18678205409,108136164,Thời Trang KHATOCO,Áo sơ mi nam tay ngắn Khatoco họa tiết xanh rêu mã A1MN568T2-ININ015-2102-N,VND,60,2023-02-24,0,0,100011,,397600,397600,397600,568000,568000,30,0,0,0,0,0,0,0.0,Khánh Hòa,2023-11-24
18812557079,108136164,Thời Trang KHATOCO,Áo sơ mi nam tay dài Khatoco caro xanh mã A1MD468T1-CNCR228-2307-D,VND,12,2023-02-24,1,0,100011,,397800,397800,397800,468000,468000,15,0,0,0,0,0,0,0.0,Khánh Hòa,2023-11-24
19068831130,108136164,Thời Trang KHATOCO,Áo thun lót nam Khatoco màu trơn xanh mã A4MN170R2-VNMA003-2407-N,VND,18,2023-02-24,0,0,100011,,136000,136000,153000,170000,170000,20,0,0,0,0,0,0,0.0,Khánh Hòa,2023-11-24
19137428680,108136164,Thời Trang KHATOCO,Áo sơ mi nam tay dài Khatoco kẻ sọc xám mã A1MD468T1-CNCR001-2406-D,VND,15,2023-02-24,0,0,100011,,397800,397800,397800,468000,468000,15,0,0,0,0,0,0,0.0,Khánh Hòa,2023-11-24
19178279902,108136164,Thời Trang KHATOCO,Quần lót nam brief Khatoco màu trơn xám đậm mã Q4M098R0-VNMA051-2411-T,VND,64,2023-02-24,2,0,100011,,83300,83300,83300,98000,98000,15,0,0,0,0,0,0,0.0,Khánh Hòa,2023-11-24
19178279904,108136164,Thời Trang KHATOCO,Quần lót nam Khatoco sọc đen mã Q4M118R0-VNSC005-2411-T,VND,76,2023-02-24,1,0,100011,,100300,100300,100300,118000,118000,15,0,0,0,0,0,0,0.0,Khánh Hòa,2023-11-24
19226752692,108136164,Thời Trang KHATOCO,Áo sơ mi nam tay dài Khatoco caro xanh mã A1MD468T1-CNCR250-2307-D,VND,1,2023-02-24,0,0,100011,,397800,397800,397800,468000,468000,15,0,0,0,0,0,0,0.0,Khánh Hòa,2023-11-24
19467197451,108136164,Thời Trang KHATOCO,Áo thun polo nam Khatoco màu trơn đen mã A2MN398R2-CNMA003-2407-N,VND,1,2023-02-24,4,1,100011,,398000,398000,398000,-1,-1,0,0,0,0,0,0,0,0.0,Khánh Hòa,2023-11-24
19843509936,108136164,Thời Trang KHATOCO,Quần tây nam Khatoco form Slimfit không ly màu xanh mã Q1M428S0-CNMA043-2301-0,VND,2,2023-02-25,0,0,100011,,363800,363800,363800,428000,428000,15,0,0,0,0,0,0,0.0,Khánh Hòa,2023-11-24
20367204030,108136164,Thời Trang KHATOCO,Áo thun polo nam Khatoco họa tiết xanh mã A2MN398R2-CNMK033-2407-N,VND,1,2023-02-25,0,0,100011,,338300,338300,338300,398000,398000,15,0,0,0,0,0,0,0.0,Khánh Hòa,2023-11-24
8003193475,108136164,Thời Trang KHATOCO,Áo sơ mi nam tay dài kẻ màu xanh tím kẻ caro Khatoco mã A1MD468T1-CNCR031-2204-D,VND,64,2023-02-25,0,0,100011,KHATOCO,327600,327600,327600,468000,468000,30,0,0,0,0,0,0,0.0,Khánh Hòa,2023-11-24
11187167707,108136164,Thời Trang KHATOCO,Áo sơ mi nam tay dài kẻ caro Khatoco mã A1MD398T1-CNCR208-2307-D,VND,2,2023-02-25,0,0,100011,,278600,278600,278600,398000,398000,30,0,0,0,0,0,0,0.0,Khánh Hòa,2023-11-24
12020214475,108136164,Thời Trang KHATOCO,Áo sơ mi nam Khatoco tay dài kẻ caro mã A1MD398T1-ININ033-2111-D,VND,1,2023-02-27,1,1,100011,,278600,278600,278600,398000,398000,30,0,0,0,0,0,0,0.0,Khánh Hòa,2023-11-24
15085373955,108136164,Thời Trang KHATOCO,Áo sơ mi nam Khatoco tay dài caro đỏ xám mã A1MD398T1-CNCR267-2311-D,VND,2,2023-02-27,1,0,100011,,338300,338300,338300,398000,398000,15,0,0,0,0,0,0,0.0,Khánh Hòa,2023-11-24
20566872124,108136164,Thời Trang KHATOCO,Áo sơ mi nam tay dài Khatoco caro xanh mã A1MD468T1-CNCR256-2307-D,VND,25,2023-02-27,1,0,100011,,397800,397800,397800,468000,468000,15,0,0,0,0,0,0,0.0,Khánh Hòa,2023-11-24
16494095233,108136164,Thời Trang KHATOCO,Áo sơ mi nam Khatoco tay dài họa tiết Khatoco màu tím xanh mã A1MD468T1-CNMK015-2204-D,VND,84,2023-02-27,0,0,100011,,327600,327600,351000,468000,468000,30,0,0,0,0,0,0,0.0,Khánh Hòa,2023-11-24
16494095247,108136164,Thời Trang KHATOCO,Áo sơ mi nam tay dài Khatoco caro xanh mã A1MD468T1-CNCR105-2409-D,VND,8,2023-02-27,0,0,100011,,374400,374400,397800,468000,468000,20,0,0,0,0,0,0,0.0,Khánh Hòa,2023-11-24
16594095215,108136164,Thời Trang KHATOCO,Áo sơ mi nam tay dài Khatoco caro xanh mã A1MD468T1-CNCR069-2409-D,VND,25,2023-02-28,0,0,100011,,397800,397800,397800,468000,468000,15,0,0,0,0,0,0,0.0,Khánh Hòa,2023-11-24
16704068596,108136164,Thời Trang KHATOCO,Áo sơ mi nam tay dài kẻ caro Khatoco mã A1MD468T1-CNCR181-2305-D,VND,11,2023-02-28,0,0,100011,,374400,374400,421200,468000,468000,20,0,0,0,0,0,0,0.0,Khánh Hòa,2023-11-24
16790947353,108136164,Thời Trang KHATOCO,Áo sơ mi nam tay ngắn Khatoco họa tiết mã A1MN388T2-ININ025-2307-N,VND,32,2023-02-28,0,0,100011,,329800,329800,329800,388000,388000,15,0,0,0,0,0,0,0.0,Khánh Hòa,2023-11-24
17282978213,108136164,Thời Trang KHATOCO,Áo sơ mi nam tay dài Khatoco caro trắng xanh mã A1MD468T1-CNCR244-2307-D,VND,53,2023-02-28,0,0,100011,,397800,397800,421200,468000,468000,15,0,0,0,0,0,0,0.0,Khánh Hòa,2023-11-24
17994103104,108136164,Thời Trang KHATOCO,Áo sơ mi nam tay dài Khatoco caro xanh mã A1MD468T1-CNCR108-2409-D,VND,39,2023-02-28,0,0,100011,,397800,397800,397800,468000,468000,15,0,0,0,0,0,0,0.0,Khánh Hòa,2023-11-24
18010626712,108136164,Thời Trang KHATOCO,Áo sơ mi nam Khatoco ngắn tay kẻ caro màu xanh mã A1MN538T2-CNCR168-2305-N,VND,2,2023-02-28,2,0,100011,,457300,457300,457300,538000,538000,15,0,0,0,0,0,0,0.0,Khánh Hòa,2023-11-24
6603413365,108136164,Thời Trang KHATOCO,Áo sơ mi nam Khatoco tay ngắn màu xanh mã A1MN438S1-CNMA004-2102-N,VND,225,2023-02-28,4,0,100011,0,306600,306600,306600,438000,438000,30,2,0,0,0,0,2,5.0,Khánh Hòa,2023-11-24
6645970768,108136164,Thời Trang KHATOCO,Áo sơ mi nam tay ngắn kẻ caro Khatoco mã A1MN388T2-THCR009-2201-N,VND,25,2023-02-28,7,2,100011,KHATOCO,271600,271600,291000,388000,388000,30,3,0,0,0,0,3,5.0,Khánh Hòa,2023-11-24
12622058210,108136164,Thời Trang KHATOCO,Áo sơ mi nam Khatoco ngắn tay kẻ caro mã A1MN388T2-CNCR112-2212-N,VND,45,2023-02-28,3,1,100011,,271600,271600,271600,388000,388000,30,1,0,0,0,0,1,5.0,Khánh Hòa,2023-11-24
12720211699,108136164,Thời Trang KHATOCO,Áo sơ mi nam Khatoco ngắn tay kẻ sọc mã A1MN378T2-CNSC009-2303-N,VND,70,2023-02-28,2,1,100011,,321300,321300,321300,378000,378000,15,1,0,0,0,0,1,5.0,Khánh Hòa,2023-11-24
16604067345,108136164,Thời Trang KHATOCO,Áo sơ mi nam tay dài kẻ caro Khatoco mã A1MD468T1-CNCR177-2305-D,VND,7,2023-03-01,1,1,100011,,397800,397800,397800,468000,468000,15,1,0,0,0,0,1,5.0,Khánh Hòa,2023-11-24
22138121572,108136164,Thời Trang KHATOCO,Quần lót nam brief Khatoco màu trơn xanh mã Q4M098R0-VNMA045-2411-T,VND,21,2023-03-01,2,1,100011,,78400,78400,78400,98000,98000,20,1,0,0,0,0,1,5.0,Khánh Hòa,2023-11-24
22138121577,108136164,Thời Trang KHATOCO,Quần lót nam Khatoco boxer màu đen mã Q5M085R0-VNMA014-2112-B,VND,80,2023-03-01,1,1,100011,,68000,68000,68000,85000,85000,20,1,0,0,0,0,1,5.0,Khánh Hòa,2023-11-24
22138126567,108136164,Thời Trang KHATOCO,Quần lót nam Khatoco boxer màu đen mã Q5M085R0-VNMA013-2112-B,VND,50,2023-03-01,12,0,100011,,68000,68000,68000,85000,85000,20,2,0,0,0,0,2,5.0,Khánh Hòa,2023-11-24
22237923617,108136164,Thời Trang KHATOCO,Áo sơ mi nam tay dài Khatoco caro xanh rêu mã A1MD398T1-CNCR021-2203-D,VND,7,2023-03-01,1,0,100011,,338300,338300,338300,398000,398000,15,1,0,0,0,0,1,5.0,Khánh Hòa,2023-11-24
22838124748,108136164,Thời Trang KHATOCO,Quần lót nam boxer Khatoco sọc xanh mã Q5M128R0-VNSC001-2411-B,VND,4,2023-03-01,1,0,100011,,89600,89600,102400,128000,128000,30,1,0,0,0,0,1,5.0,Khánh Hòa,2023-11-24
21220888621,108136164,Thời Trang KHATOCO,Áo sơ mi nam tay ngắn Khatoco caro xám đậm mã A1MN468T2-CNCR217-2307-N,VND,5,2023-03-01,1,1,100011,,374400,374400,374400,468000,468000,20,1,0,0,0,0,1,5.0,Khánh Hòa,2023-11-24
18678205413,108136164,Thời Trang KHATOCO,Áo sơ mi nam tay ngắn Khatoco họa tiết xanh rêu mã A1MN568T2-CNIN009-2102-N,VND,27,2023-03-01,1,0,100011,,397600,397600,397600,568000,568000,30,1,0,0,0,0,1,5.0,Khánh Hòa,2023-11-24
20678188059,108136164,Thời Trang KHATOCO,Áo sơ mi nam tay ngắn Khatoco caro xanh rêu mã A1MN468T2-CNCR078-2112-N,VND,16,2023-03-01,1,0,100011,,351000,351000,351000,468000,468000,25,1,0,0,0,0,1,5.0,Khánh Hòa,2023-11-24
22380196014,108136164,Thời Trang KHATOCO,Áo sơ mi nam tay dài Khatoco họa tiết xanh mã A1MD568T1-CNIN322-2504-D,VND,26,2023-03-01,0,0,100011,,482800,482800,482800,568000,568000,15,0,0,0,0,0,0,0.0,Khánh Hòa,2023-11-24
22380196198,108136164,Thời Trang KHATOCO,Áo sơ mi nam tay ngắn Khatoco caro màu xanh mã A1MN468T2-CNCR264-2412-N,VND,33,2023-03-01,0,0,100011,,421200,421200,421200,468000,468000,10,0,0,0,0,0,0,0.0,Khánh Hòa,2023-11-24
22380208304,108136164,Thời Trang KHATOCO,Áo sơ mi nam tay dài Khatoco caro xanh mã A1MD468T1-CNCR113-2409-D,VND,60,2023-03-02,0,0,100011,,397800,397800,397800,468000,468000,15,0,0,0,0,0,0,0.0,Khánh Hòa,2023-11-24
22680213143,108136164,Thời Trang KHATOCO,Áo sơ mi nam tay dài Khatoco caro xanh mã A1MD498T1-CNCR091-2409-D,VND,2,2023-03-04,0,0,100011,,423300,423300,423300,498000,498000,15,0,0,0,0,0,0,0.0,Khánh Hòa,2023-11-24
19493082964,108136164,Thời Trang KHATOCO,Áo sơ mi nam tay ngắn Khatoco caro xanh mã A1MN438T2-CNCR048-2407-N,VND,6,2023-03-06,0,0,100011,,372300,372300,372300,438000,438000,15,0,0,0,0,0,0,0.0,Khánh Hòa,2023-11-24
20493080043,108136164,Thời Trang KHATOCO,Áo sơ mi nam tay ngắn Khatoco họa tiết xám mã A1MN538T2-CNIN005-2407-N,VND,7,2023-03-06,0,0,100011,,457300,457300,457300,538000,538000,15,0,0,0,0,0,0,0.0,Khánh Hòa,2023-11-24
20793080133,108136164,Thời Trang KHATOCO,Áo sơ mi nam tay ngắn Khatoco họa tiết xanh mã A1MN468T2-CNIN008-2407-N,VND,13,2023-03-06,0,0,100011,,397800,397800,397800,468000,468000,15,0,0,0,0,0,0,0.0,Khánh Hòa,2023-11-24
23980203681,108136164,Thời Trang KHATOCO,Áo sơ mi nam tay dài Khatoco họa tiết trắng mã A1MD498T1-CNIN030-2410-D,VND,2,2023-03-06,0,0,100011,,423300,423300,423300,498000,498000,15,0,0,0,0,0,0,0.0,Khánh Hòa,2023-11-24
7445964835,108136164,Thời Trang KHATOCO,Áo sơ mi nam tay ngắn họa tiết Khatoco mã A1MN468T2-CNMK020-2111-N,VND,62,2023-03-08,4,0,100011,KHATOCO,351000,351000,351000,468000,468000,25,2,0,0,1,0,1,4.0,Khánh Hòa,2023-11-24
8323305415,108136164,Thời Trang KHATOCO,Quần lót nam boxer Khatoco màu đen xám mã Q5M085R0-VNMA015-2112-B,VND,77,2023-03-08,26,1,100011,Khatoco,68000,68000,68000,85000,85000,20,6,1,0,0,0,5,4.333333333333333,Khánh Hòa,2023-11-24
1764881544,108136164,Thời Trang KHATOCO,Áo thun ba lỗ nam Khatoco A4MN120R2-VNMA026-2010-N,VND,508,2023-03-08,14,0,100011,,84000,84000,84000,120000,120000,30,2,0,0,0,0,2,5.0,Khánh Hòa,2023-11-24
1764897709,108136164,Thời Trang KHATOCO,Áo thun ba lỗ nam Khatoco A4MN120R2-VNMA028-2010-N,VND,659,2023-03-08,25,1,100011,,84000,84000,84000,120000,120000,30,5,0,0,0,0,5,5.0,Khánh Hòa,2023-11-24
23180228325,108136164,Thời Trang KHATOCO,Áo sơ mi nam tay dài Khatoco caro xanh mã A1MD468S1-CNCR063-2408-D,VND,83,2023-03-08,0,0,100011,,421200,421200,421200,468000,468000,10,0,0,0,0,0,0,0.0,Khánh Hòa,2023-11-24
23680201424,108136164,Thời Trang KHATOCO,Áo sơ mi nam Khatoco ngắn tay màu xanh kẻ sọc mã A1MN378T2-CNSC011-2303-N,VND,60,2023-03-08,0,0,100011,,321300,321300,321300,378000,378000,15,0,0,0,0,0,0,0.0,Khánh Hòa,2023-11-24
23780201237,108136164,Thời Trang KHATOCO,Áo sơ mi nam Khatoco tay ngắn kẻ sọc xanh đỏ mã A1MN378T2-CNSC010-2303-N,VND,79,2023-03-08,0,0,100011,,321300,321300,340200,378000,378000,15,0,0,0,0,0,0,0.0,Khánh Hòa,2023-11-24
23780227677,108136164,Thời Trang KHATOCO,Áo sơ mi nam tay ngắn Khatoco caro xanh mã A1MN388S1-CNCR279-2311-N,VND,40,2023-03-08,0,0,100011,,329800,329800,329800,388000,438000,25,0,0,0,0,0,0,0.0,Khánh Hòa,2023-11-24
