item_id,shop_id,shop_name,name,currency,stock,ctime,historical_sold,liked_count,cat_id,brand,price,price_min,price_max,price_min_before_discount,price_max_before_discount,raw_discount,rating_total,rating_1_star,rating_2_star,rating_3_star,rating_4_star,rating_5_star,rating_star,shop_location,crawl_date
24501590532,473918762,YaMe.vn Official Store,Áo Sơ Mi Nam Tay Dài Ít Nhăn Đơn Giản Thời Trang Thương Hiệu Y2010 WRINKLE FREE 01 22458 |YaMe|,VND,7,2023-04-10,18,7,100011,,270270,270270,270270,297000,297000,9,4,0,0,0,1,3,4.75,TP. Hồ Chí Minh,2024-01-15
22944409279,473918762,YaMe.vn Official Store,Áo Thun Raglan Nam Nữ Unisex Tay Ngắn Cổ Tròn Thời Trang Thương Hiệu Y2010 The Day’s Eye 02 22039 |YaMe|,VND,153,2023-04-10,202,93,100011,,226160,226160,257000,257000,257000,12,61,1,0,0,4,56,4.868852459016393,TP. Hồ Chí Minh,2024-01-15
10516376021,473918762,YaMe.vn Official Store,"Thắt Lưng Nam Khóa Tự Động Da Bò Kiểu Đơn Giản Phù Hợp Công Sở, Đi Tiệc, Đi Học Y2010 D01 18501 |YaMe|",VND,16,2023-04-10,159,45,100009,Y2010,259350,259350,259350,285000,285000,9,48,0,1,0,4,43,4.854166666666667,TP. Hồ Chí Minh,2024-01-15
22359070588,473918762,YaMe.vn Official Store,Giày Casual Nam Đơn Giản Thời Trang Thương Hiệu Y2010 Miền Gió Cát 19 22568 |YaMe|,VND,36,2023-04-10,3,2,100012,,629610,629610,629610,677000,677000,7,1,0,0,0,0,1,5.0,TP. Hồ Chí Minh,2024-01-15
22046011175,473918762,YaMe.vn Official Store,Áo Thun Nam Nữ Unisex Tay Ngắn Cổ Tròn Họa Tiết Cúc Họa Mi Thương Hiệu Y2010 The Day’s Eye 23 22078 |YaMe|,VND,16,2023-04-10,30,17,100011,,226160,226160,257000,257000,257000,12,8,0,0,0,0,8,5.0,TP. Hồ Chí Minh,2024-01-15
21525335885,473918762,YaMe.vn Official Store,Áo Khoác Varsity Nam Nữ Form Rộng Đơn Giản Thương Hiệu Y2010 Ver45 20853 |YaMe|,VND,75,2023-04-10,106,123,100011,,543270,543270,543270,597000,597000,9,29,0,0,0,2,27,4.931034482758621,TP. Hồ Chí Minh,2024-01-15
22587921781,473918762,YaMe.vn Official Store,Quần Dài Nam Lưng Thun Co Giãn Đơn Giản Thời Trang Thương Hiệu Y2010 BST Thiết Kế ONE PIECE 44 22603 |YaMe|,VND,53,2023-04-10,6,2,100011,,387000,387000,387000,-1,-1,0,3,0,0,0,0,3,5.0,TP. Hồ Chí Minh,2024-01-15
25901489235,473918762,YaMe.vn Official Store,Áo Polo Nam Tay Ngắn Đơn Giản Thời Trang Thương Hiệu Y2010 Cool Touch 06 22627 |YaMe|,VND,46,2023-04-10,14,5,100011,,261170,261170,261170,287000,287000,9,4,0,0,0,0,4,5.0,TP. Hồ Chí Minh,2024-01-15
21659232688,473918762,YaMe.vn Official Store,Combo 3 Quần Lót Nam Boxer Brief Mềm Mại Thấm Hút Mồ Hôi Thương Hiệu Y2010 M11 21580 |YaMe|,VND,74,2023-04-10,57,8,100011,,77600,77600,221600,97000,277000,20,18,0,0,0,0,18,5.0,TP. Hồ Chí Minh,2024-01-15
19886845684,473918762,YaMe.vn Official Store,Áo khoác Nam Nữ Uniex Chống Nắng Thời Trang Thương Hiệu Y2010 BST Thiết Kế ONE PIECE 43 22679 |YaMe|,VND,16,2023-04-10,3,6,100011,,697000,697000,697000,-1,-1,0,2,0,0,0,0,2,5.0,TP. Hồ Chí Minh,2024-01-15
23444412462,473918762,YaMe.vn Official Store,Áo Thun Nam Nữ Unisex Tay Ngắn Cổ Tròn Thời Trang Thương Hiệu Y2010 The Day’s Eye 21 22067 |YaMe|,VND,15,2023-04-10,58,11,100011,,199760,199760,227000,227000,227000,12,27,0,0,0,1,26,4.962962962962963,TP. Hồ Chí Minh,2024-01-15
22338570245,473918762,YaMe.vn Official Store,Quần Tây Nam Tối Giản Thương Hiệu Y2010 HG11 19800,VND,395,2023-04-10,34,10,100011,,350350,350350,350350,385000,385000,9,12,0,0,1,0,11,4.833333333333333,TP. Hồ Chí Minh,2024-01-15
23482977808,473918762,YaMe.vn Official Store,Ví Nam Dáng Ngang Cao Cấp Thời Trang Y2010 Kèm Hộp Sang Trọng Thích Hợp Làm Quà Tặng  BST Tài Lộc 01 - 22433 |YaMe|,VND,34,2023-04-10,20,8,100533,,361270,361270,361270,397000,397000,9,9,1,1,0,0,7,4.222222222222222,TP. Hồ Chí Minh,2024-01-15
10580981866,473918762,YaMe.vn Official Store,"Balo Nam Nữ Thời Trang Đi Học, Đựng Laptop Thương Hiệu Y2010 Big Ngân Hà Space Ver1 20459 |YaMe|",VND,2,2023-04-10,71,60,100533,,239400,239400,239400,399000,399000,40,35,0,0,0,1,34,4.9714285714285715,TP. Hồ Chí Minh,2024-01-15
24102958998,473918762,YaMe.vn Official Store,Áo Polo Nam Tay Ngắn Form Rộng Thời Trang Thương Hiệu Y2010  BST Thiết Kế ONE PIECE 15 22447 |YaMe|,VND,14,2023-04-11,4,3,100011,,282150,282150,282150,297000,297000,5,2,0,0,0,0,2,5.0,TP. Hồ Chí Minh,2024-01-15
23946004952,473918762,YaMe.vn Official Store,Áo Thun 3 Lỗ Nam Thoải Mái Cá Tính Thương Hiệu Y2010 The Day’s Eye 40 22096 |YaMe|,VND,68,2023-04-11,28,20,100011,,179270,179270,179270,197000,197000,9,8,0,0,0,0,8,5.0,TP. Hồ Chí Minh,2024-01-15
18685113030,473918762,YaMe.vn Official Store,Giày Tây Lười Nam Da Thật Nguyên Bản A8 Thời Trang Thương Hiệu Y2010 2023 22429 |YaMe|,VND,12,2023-04-11,12,7,100012,,611010,611010,611010,657000,657000,7,2,0,0,0,0,2,5.0,TP. Hồ Chí Minh,2024-01-15
23087918793,473918762,YaMe.vn Official Store,Áo Thun Nam Tay Ngắn Cổ Tròn Cotton Co Giãn 4 Chiều Thời Trang Thương Hiệu Y2010  BST Thiết Kế ONE PIECE 06  22445 |YaMe,VND,14,2023-04-11,9,11,100011,,226160,226160,257000,257000,257000,12,5,0,0,0,0,5,5.0,TP. Hồ Chí Minh,2024-01-15
18616549671,473918762,YaMe.vn Official Store,Áo Thun Nam Tay Ngắn Cổ Tròn Thần Cổ Đại Poseidon Y2010 Ver4 21033 |YaMe|,VND,20,2023-04-11,69,28,100011,,243950,243950,243950,287000,287000,15,31,0,0,2,0,29,4.870967741935484,TP. Hồ Chí Minh,2024-01-15
18591664488,473918762,YaMe.vn Official Store,Túi Trống Túi Đeo Đựng Đồ Đi Chơi Đi Du Lịch Nhiều Kích Thước Thương Hiệu Y2010 Daily Khởi Nguyên 22378 |YaMe|,VND,103,2023-04-11,43,14,100533,,227000,227000,267000,277000,337000,21,18,0,0,0,2,16,4.888888888888889,TP. Hồ Chí Minh,2024-01-15
23182978921,473918762,YaMe.vn Official Store,Thắt Lưng Nam Khóa Tự Động Màu Đen Da Bò Thật Y2010 Dây Nịt Nam Bền Đẹp Sang Trọng Đi Làm Đi Học Nguyên Bản M20 - 22734,VND,69,2023-04-11,27,5,100009,,261170,261170,261170,287000,287000,9,9,0,0,0,1,8,4.888888888888889,TP. Hồ Chí Minh,2024-01-15
22871493134,473918762,YaMe.vn Official Store,Quần Jean Dài Nam Slimfit Đơn Giản Thời Trang Thương Hiệu Y2010 The Day’s Eye 38 22099 |YaMe|,VND,38,2023-04-11,51,4,100011,,324870,324870,357000,357000,357000,9,14,0,0,0,0,14,5.0,TP. Hồ Chí Minh,2024-01-15
25702964672,473918762,YaMe.vn Official Store,Áo Thun Nam Tay Ngắn Cổ Tròn Cotton Co Giãn 4 Chiều Thời Trang Thương Hiệu Y2010  BST Thiết Kế ONE PIECE 12 22449 |YaMe|,VND,17,2023-04-11,3,0,100011,,257000,257000,257000,-1,-1,0,1,0,0,0,0,1,5.0,TP. Hồ Chí Minh,2024-01-15
16395833842,473918762,YaMe.vn Official Store,Nón Lưỡi Trai Trơn Đơn Giản Nam Nữ Unisex Thời Trang Thương Hiệu Y2010 SPEED 49 22391 |YaMe|,VND,37,2023-04-11,18,5,100009,,155760,155760,155760,177000,177000,12,3,0,0,0,0,3,5.0,TP. Hồ Chí Minh,2024-01-15
22847096589,473918762,YaMe.vn Official Store,Quần Jogger Jean Nam Đơn Giản Thời Trang Thương Hiệu Y2010 Cosmo 29 22286 |YaMe|,VND,86,2023-04-11,50,10,100011,,285600,285600,285600,357000,357000,20,22,0,0,1,0,21,4.909090909090909,TP. Hồ Chí Minh,2024-01-15
19019298060,473918762,YaMe.vn Official Store,Áo Khoác Cardigan Nam Nữ Đơn Giản Thương Hiệu Y2010 Ver46 21049 |YaMe|,VND,74,2023-04-11,273,576,100011,,328950,328950,328950,387000,387000,15,102,1,1,1,4,95,4.872549019607843,TP. Hồ Chí Minh,2024-01-15
18852694201,473918762,YaMe.vn Official Store,Balo Đi Học Nam Nữ Giá Rẻ Thời Trang Kiểu Đơn Giản Thương Hiệu Y2010 Basic 21527 |YaMe|,VND,5,2023-04-11,227,131,100533,,154200,154200,154200,257000,257000,40,74,1,0,2,4,67,4.837837837837838,TP. Hồ Chí Minh,2024-01-15
18586146670,473918762,YaMe.vn Official Store,Quần Short Nam Đơn Giản Thoáng Mát Thời Trang Thương Hiệu Y2010 Cool Touch 04 22617 |YaMe|,VND,170,2023-04-11,43,11,100011,,261170,261170,261170,287000,287000,9,8,0,0,0,0,8,5.0,TP. Hồ Chí Minh,2024-01-15
15397915370,473918762,YaMe.vn Official Store,Túi Đeo Chéo Nam Đơn Giản Daily Thời Trang Thương Hiệu Y2010 Khởi Nguyên 3 22376 |YaMe|,VND,121,2023-04-11,24,13,100533,,233870,233870,233870,257000,257000,9,10,1,0,0,0,9,4.6,TP. Hồ Chí Minh,2024-01-15
10998828603,473918762,YaMe.vn Official Store,Nón Lưỡi Trai Nam Nữ Thời Trang Nhiều Màu Thương Hiệu Y2010 Ver10 21787 |YaMe|,VND,24,2023-04-11,65,21,100009,,141600,141600,141600,177000,177000,20,23,0,0,0,0,23,5.0,TP. Hồ Chí Minh,2024-01-15
23849876878,473918762,YaMe.vn Official Store,Quần Tây Nam Đơn Giản Thời Trang Thương Hiệu Y2010 Cosmo 25 22185 |YaMe|,VND,240,2023-04-11,59,19,100011,,388570,388570,388570,427000,427000,9,11,0,0,0,0,11,5.0,TP. Hồ Chí Minh,2024-01-15
17594724405,473918762,YaMe.vn Official Store,Balo Nam Nữ Modern Đơn Giản Đi Học Đi Chơi Thời Trang Thương Hiệu Y2010 TSONS 85 22030 |YaMe|,VND,17,2023-04-11,61,50,100533,,178200,178200,178200,297000,297000,40,21,0,0,0,0,21,5.0,TP. Hồ Chí Minh,2024-01-15
22997063069,473918762,YaMe.vn Official Store,Găng Tay Nam Nữ Chống UV Chuyên Phượt Thời Trang Thương Hiệu Y2010 TSONS Chống Nắng 96 22616 |YaMe|,VND,382,2023-04-11,98,19,100009,,48500,48500,48500,97000,97000,50,13,0,0,0,0,13,5.0,TP. Hồ Chí Minh,2024-01-15
22941109881,473918762,YaMe.vn Official Store,Giày Tây Nam Cột Dây Da Thật Thời Trang Thương Hiệu Y2010 TSONS 44 2023 21920 |YaMe|,VND,9,2023-04-11,6,10,100012,,927210,927210,927210,997000,997000,7,1,0,0,0,0,1,5.0,TP. Hồ Chí Minh,2024-01-15
21477811479,473918762,YaMe.vn Official Store,Áo Hoodie Unisex Thời Trang Thương Hiệu Y2010 Ver3 21714 |YaMe|,VND,63,2023-04-11,35,22,100011,,274200,274200,274200,457000,457000,40,14,1,0,0,2,11,4.571428571428571,TP. Hồ Chí Minh,2024-01-15
22351250690,473918762,YaMe.vn Official Store,Balo Daily Nam Nữ Khởi Nguyên 9 Thời Trang Thương Hiệu Y2010 22423 |YaMe|,VND,54,2023-04-11,44,12,100533,,365600,365600,365600,457000,457000,20,17,0,0,0,2,15,4.882352941176471,TP. Hồ Chí Minh,2024-01-15
19325342189,473918762,YaMe.vn Official Store,Áo Thun Polo Nam Đơn Giản Thần Cổ Đại Khepri Y2010 Ver3 20848 |YaMe|,VND,10,2023-04-11,47,73,100011,,252560,252560,252560,287000,287000,12,11,0,0,0,0,11,5.0,TP. Hồ Chí Minh,2024-01-15
22759841349,473918762,YaMe.vn Official Store,Áo Khoác Lá Nam Cổ Đơn Giản Thời Trang Thương Hiệu Y2010 Premium 19 22531 |YaMe|,VND,34,2023-04-11,4,3,100011,,488670,488670,488670,537000,537000,9,1,0,0,0,0,1,5.0,TP. Hồ Chí Minh,2024-01-15
20286845985,473918762,YaMe.vn Official Store,Áo Sơ Mi Nam Tay Ngắn Nhanh Khô Thời Trang Thương Hiệu Y2010 BST Thiết Kế ONE PIECE 31 22682 |YaMe|,VND,14,2023-04-11,6,7,100011,,297000,297000,297000,-1,-1,0,2,0,0,0,0,2,5.0,TP. Hồ Chí Minh,2024-01-15
22869908449,473918762,YaMe.vn Official Store,Quần Short KaKi Nhung Nam Đơn Giản Thời Trang Thương Hiệu Y2010 The Day’s Eye 25 22074 |YaMe|,VND,151,2023-04-11,45,9,100011,,297570,297570,327000,327000,327000,9,11,0,0,0,0,11,5.0,TP. Hồ Chí Minh,2024-01-15
14186805071,473918762,YaMe.vn Official Store,Quần Jogger Nam Tối Giản Thương Hiệu Y2010 M3 20736 |YaMe|,VND,28,2023-04-11,86,32,100011,,348650,348650,348650,367000,367000,5,30,0,0,0,2,28,4.933333333333334,TP. Hồ Chí Minh,2024-01-15
11899865721,473918762,YaMe.vn Official Store,Áo Thun Raglang Nam Tay Ngắn Cổ Tròn Thời Trang Thương Hiệu Y2010 SPEED 14 22353 |YaMe|,VND,83,2023-04-11,16,16,100011,,206570,206570,206570,227000,227000,9,2,0,0,0,0,2,5.0,TP. Hồ Chí Minh,2024-01-15
15762907964,473918762,YaMe.vn Official Store,Thắt Lưng Nam Cao Cấp Chất Liệu Da Bò Thương Hiệu Y2010 Nguyên Bản M19 20637 |YaMe|,VND,75,2023-04-11,66,20,100009,,259350,259350,259350,285000,285000,9,24,0,0,0,0,24,5.0,TP. Hồ Chí Minh,2024-01-15
18451784206,473918762,YaMe.vn Official Store,Áo Thun Nam Tay Ngắn Cổ Tròn Đơn Giản Thời Trang Thương Hiệu Y2010 Nguyên Bản Ver73 21135 |YaMe|,VND,8,2023-04-11,127,83,100011,,192950,192950,192950,227000,227000,15,49,0,0,1,2,46,4.918367346938775,TP. Hồ Chí Minh,2024-01-15
10399865967,473918762,YaMe.vn Official Store,Áo Thun Nam Tay Ngắn Cổ Tròn Thời Trang Thương Hiệu Y2010 SPEED 18 22335 |YaMe|,VND,13,2023-04-11,15,15,100011,,261170,261170,261170,287000,287000,9,5,0,0,0,0,5,5.0,TP. Hồ Chí Minh,2024-01-15
23952633616,473918762,YaMe.vn Official Store,Áo Sơ Mi Nam Tay Ngắn Thấm Hút Nhanh Khô Co Giãn Thời Trang Thương Hiệu Y2010 SPEED 40 22388 |YaMe|,VND,2,2023-04-11,5,5,100011,,270270,270270,270270,297000,297000,9,0,0,0,0,0,0,0.0,TP. Hồ Chí Minh,2024-01-15
20583428578,473918762,YaMe.vn Official Store,Áo Polo Nam Form Rộng Vải Cotton 2 Chiều Thấm Hút Phong Cách Năng Động Thương Hiệu Y2010 SPEED 23 223,VND,43,2023-04-11,7,2,100011,,252070,252070,252070,277000,277000,9,4,0,0,0,1,3,4.75,TP. Hồ Chí Minh,2024-01-15
22378187907,473918762,YaMe.vn Official Store,Áo Polo Nam Tay Ngắn Thời Trang Thương Hiệu Y2010 SPEED 26 22344 |YaMe|,VND,107,2023-04-11,12,12,100011,,270270,270270,270270,297000,297000,9,1,0,0,0,0,1,5.0,TP. Hồ Chí Minh,2024-01-15
18469484340,473918762,YaMe.vn Official Store,Quần Short Nam Thể Thao Thời Trang Thương Hiệu Y2010 Nguyên Bản Ver53 21795 |YaMe|,VND,39,2023-04-11,26,9,100011,,233870,233870,233870,257000,257000,9,8,0,0,0,0,8,5.0,TP. Hồ Chí Minh,2024-01-15
16979005456,473918762,YaMe.vn Official Store,Ví Nam Da Bò Thật Thời Trang Dáng Ngang Cao Cấp Thương Hiệu Y2010 Bóp Nam Cầm Tay Đa Nặng Tặng Kèm Hộp V25 21246 |YaMe|,VND,1,2023-04-11,102,39,100533,,257000,257000,257000,-1,-1,0,38,0,1,1,4,32,4.7631578947368425,TP. Hồ Chí Minh,2024-01-15
20595767090,473918762,YaMe.vn Official Store,Áo Thun Nam Tay Ngắn Cổ Tròn Cotton Co Giãn 4 Chiều Thời Trang Thương Hiệu Y2010  BST Thiết Kế ONE PIECE 07 22439 |YaMe|,VND,16,2023-04-11,3,2,100011,,244150,244150,244150,257000,257000,5,1,0,0,0,0,1,5.0,TP. Hồ Chí Minh,2024-01-15
18916544264,473918762,YaMe.vn Official Store,Áo Thun Nam Nữ Tay Ngắn Cổ Tròn Linh Vật Rồng Y2010 Ver6 21163 |YaMe|,VND,9,2023-04-11,42,23,100011,,205600,205600,205600,257000,257000,20,11,2,0,0,0,9,4.2727272727272725,TP. Hồ Chí Minh,2024-01-15
22041096787,473918762,YaMe.vn Official Store,Áo Sơ Mi Nam Tay Dài Cotton Thời Trang Thương Hiệu Y2010 TSONS 31 21348 |YaMe|,VND,78,2023-04-11,92,39,100011,,226160,226160,226160,257000,257000,12,35,0,1,0,1,33,4.885714285714286,TP. Hồ Chí Minh,2024-01-15
15897399443,473918762,YaMe.vn Official Store,Nón Lưỡi Trai Trơn Đơn Giản Nam Nữ Unisex Thời Trang Thương Hiệu Y2010 The Style Of No Style 58 21996 |YaMe|,VND,44,2023-04-11,21,4,100009,,85360,85360,85360,97000,97000,12,7,0,0,0,0,7,5.0,TP. Hồ Chí Minh,2024-01-15
22485375385,473918762,YaMe.vn Official Store,Quần Jean Dài Nam Slimfit  Đơn Giản Thời Trang Thương Hiệu Y2010 Premium 39 22637 |YaMe|,VND,97,2023-04-11,8,1,100011,,388570,388570,388570,427000,427000,9,3,0,0,0,0,3,5.0,TP. Hồ Chí Minh,2024-01-15
20622724956,473918762,YaMe.vn Official Store,Áo Khoác Cardigan Nam Nữ Thương Hiệu Y2010 Ver38 21124 |YaMe|,VND,8,2023-04-11,181,389,100011,,362950,362950,362950,427000,427000,15,58,0,0,1,1,56,4.948275862068965,TP. Hồ Chí Minh,2024-01-15
21586304615,473918762,YaMe.vn Official Store,Áo Sơ Mi Nam Tay Ngắn Đơn Giản Form Rộng Thời Trang Thương Hiệu Y2010 WRINKLE FREE 04 22631 |YaMe|,VND,10,2023-04-11,17,13,100011,,234960,234960,234960,267000,267000,12,6,0,0,0,1,5,4.833333333333333,TP. Hồ Chí Minh,2024-01-15
24652958253,473918762,YaMe.vn Official Store,Áo Polo Nam Tay Ngắn Form Rộng Thời Trang Thương Hiệu Y2010  BST Thiết Kế ONE PIECE 14 22448 |YaMe|,VND,8,2023-04-11,9,2,100011,,297000,297000,297000,-1,-1,0,3,0,0,0,0,3,5.0,TP. Hồ Chí Minh,2024-01-15
22442852982,473918762,YaMe.vn Official Store,Áo Sơ Mi Nam Tay Ngắn Đơn Giản Thời Trang Thương Hiệu Y2010 TSONS 79 21394 |YaMe|,VND,41,2023-04-11,46,25,100011,,279370,279370,279370,307000,307000,9,10,0,0,0,0,10,5.0,TP. Hồ Chí Minh,2024-01-15
22446010883,473918762,YaMe.vn Official Store,Áo Sơ Mi  Nam Nữ Unisex Họa Tiết Form Rộng Tay Ngắn Thời Trang Thương Hiệu Y2010 The Day’s Eye 46 22104 |YaMe|,VND,71,2023-04-11,22,25,100011,,233870,233870,233870,257000,257000,9,2,0,0,0,0,2,5.0,TP. Hồ Chí Minh,2024-01-15
19794873026,473918762,YaMe.vn Official Store,Quần Short  Nam Lưng Thun Trên Gối Vải Dù Nhanh Khô Form Rộng Thời Trang Thương Hiệu Y2010 Bbuff Ver1 20423 |YaMe|,VND,150,2023-04-11,16,1,100011,,237150,237150,237150,255000,255000,7,4,1,0,0,0,3,4.0,TP. Hồ Chí Minh,2024-01-15
18470218003,473918762,YaMe.vn Official Store,Vớ Cổ Cao Nam Cao Cấp Thời Trang Thương Hiệu Y2010 Nguyên Bản V22 21854 |YaMe|,VND,74,2023-04-11,134,12,100011,,35250,35250,35250,47000,47000,25,24,0,0,1,0,23,4.916666666666667,TP. Hồ Chí Minh,2024-01-15
22478125890,473918762,YaMe.vn Official Store,Áo Thun Nam Tay Ngắn Cổ Tròn Thời Trang Thương Hiệu Y2010 SPEED 12 22360 |YaMe|,VND,20,2023-04-11,10,5,100011,,239010,239010,239010,257000,257000,7,1,0,0,0,0,1,5.0,TP. Hồ Chí Minh,2024-01-15
9474963235,473918762,YaMe.vn Official Store,Quần Lót Nam Trunk Basic Nhiều Màu Thương Hiệu Y2010 A02 19850 |YaMe|,VND,161,2023-04-11,137,17,100011,Y2010,79200,79200,79200,99000,99000,20,23,0,0,0,0,23,5.0,TP. Hồ Chí Minh,2024-01-15
22782160525,473918762,YaMe.vn Official Store,Áo Polo Nam Tay Ngắn Thời Trang Thương Hiệu Y2010 Premium 21 22536 |YaMe|,VND,27,2023-04-11,12,7,100011,,270270,270270,270270,297000,297000,9,7,0,0,0,0,7,5.0,TP. Hồ Chí Minh,2024-01-15
12799355884,473918762,YaMe.vn Official Store,Áo Thun Nam Tay Ngắn Cổ Tròn Cotton Co Giãn 4 Chiều Thời Trang Thương Hiệu Y2010  BST Thiết Kế ONE PIECE 11 22442 |YaMe|,VND,17,2023-04-11,3,4,100011,,297000,297000,297000,-1,-1,0,0,0,0,0,0,0,0.0,TP. Hồ Chí Minh,2024-01-15
19569271611,473918762,YaMe.vn Official Store,Áo Thun Nam Tay Ngắn Cổ Tròn Đơn Giản Thời Trang Thương Hiệu Y2010 Nguyên Bản Ver95 21458 |YaMe|,VND,25,2023-04-11,45,13,100011,,226160,226160,226160,257000,257000,12,13,0,0,0,0,13,5.0,TP. Hồ Chí Minh,2024-01-15
23549534706,473918762,YaMe.vn Official Store,Ví Nam Dáng Ngang Đơn Giản Thời Trang Thương Hiệu Y2010 M3 22282 |YaMe|,VND,18,2023-04-11,11,12,100533,,179270,179270,179270,197000,197000,9,6,0,0,0,0,6,5.0,TP. Hồ Chí Minh,2024-01-15
10899652439,473918762,YaMe.vn Official Store,Áo Sơ Mi Nam Tay Ngắn Ít Nhăn Đơn Giản Form Rộng Thời Trang Thương Hiệu Y2010 WRINKLE FREE 08 22474 |YaMe|,VND,83,2023-04-11,10,4,100011,,340560,340560,340560,387000,387000,12,4,0,0,0,0,4,5.0,TP. Hồ Chí Minh,2024-01-15
18382935879,473918762,YaMe.vn Official Store,Balo Modern Nam Nữ Cao Cấp Thương Hiệu Thương Hiệu Y2010 Khởi Nguyên 2 22375 |YaMe|,VND,88,2023-04-11,12,13,100533,,397600,397600,397600,497000,497000,20,3,0,0,0,0,3,5.0,TP. Hồ Chí Minh,2024-01-15
16278998604,473918762,YaMe.vn Official Store,Áo khoác Varsity Nam Nữ Form Rộng Phong Cách Cá Tính Thương Hiệu Y2010 Ver29 20729 |YaMe|,VND,11,2023-04-11,78,79,100011,,476000,476000,525600,595000,657000,20,28,0,0,1,3,24,4.821428571428571,TP. Hồ Chí Minh,2024-01-15
19679980255,473918762,YaMe.vn Official Store,Áo Khoác Classic Đơn Giản Nam Nữ Thời Trang Thương Hiệu Y2010 TSONS 17 21326 |YaMe|,VND,71,2023-04-11,87,63,100011,,507450,507450,507450,597000,597000,15,31,0,0,0,3,28,4.903225806451613,TP. Hồ Chí Minh,2024-01-15
23969893133,473918762,YaMe.vn Official Store,Nón Lưỡi Trai Kaki Nam Nữ Unisex Đơn Giản Thời Trang Thương Hiệu Y2010 The Day’s Eye 17 22058 |YaMe|,VND,69,2023-04-11,44,9,100009,,138160,138160,138160,157000,157000,12,12,0,0,0,0,12,5.0,TP. Hồ Chí Minh,2024-01-15
23943082630,473918762,YaMe.vn Official Store,Quần Boxer Short  Nam Đơn Giản Thương Hiệu Y2010 TSONS 81 21740 |YaMe|,VND,608,2023-04-11,75,19,100011,,77040,77040,77040,107000,107000,28,18,1,0,0,1,16,4.722222222222222,TP. Hồ Chí Minh,2024-01-15
21322713624,473918762,YaMe.vn Official Store,Áo Thun Trơn Nam Tay Dài Cổ Tròn Đơn Giản Thời Trang Thương Hiệu Y2010 M12 20919 |YaMe|,VND,35,2023-04-11,156,96,100011,,226160,226160,226160,257000,257000,12,51,0,1,0,7,43,4.803921568627451,TP. Hồ Chí Minh,2024-01-15
19479937455,473918762,YaMe.vn Official Store,Áo Thun 3 Lỗ Nam Đơn Giản Co Giãn Thoáng Mát Thời Trang Thương Hiệu Y2010 The Style Of No Style 74 22017 |YaMe|,VND,2,2023-04-11,68,47,100011,,87000,87000,87000,127000,127000,31,22,1,0,0,2,19,4.7272727272727275,TP. Hồ Chí Minh,2024-01-15
22559989664,473918762,YaMe.vn Official Store,Quần Jogger Nam Đơn Giản Thời Trang Thương Hiệu Y2010 Premium 16 22526 |YaMe|,VND,76,2023-04-11,4,5,100011,,415870,415870,415870,457000,457000,9,2,0,0,0,0,2,5.0,TP. Hồ Chí Minh,2024-01-15
22020670470,473918762,YaMe.vn Official Store,Áo Thun Nam Form Rộng Tay Ngắn Cổ Tròn Đơn Giản Thần Cổ Đại Horus Thời Trang Thương Hiệu Y2010 Ver11 21635 |YaMe|,VND,38,2023-04-11,89,20,100011,,199760,199760,199760,227000,227000,12,24,0,0,0,0,24,5.0,TP. Hồ Chí Minh,2024-01-15
21586410924,473918762,YaMe.vn Official Store,Áo Sơ Mi Nam Tay Dài  Ít Nhăn Đơn Giản Thời Trang Thương Hiệu Y2010 WRINKLE FREE 02 22454 |YaMe|,VND,14,2023-04-11,11,3,100011,,261360,261360,261360,297000,297000,12,3,0,0,0,0,3,5.0,TP. Hồ Chí Minh,2024-01-15
18511184162,473918762,YaMe.vn Official Store,Combo 3 Quần Lót Nam Hip Brief Thấm Hút Thoáng Khí Y2010 M7 20971 |YaMe|,VND,177,2023-04-11,56,4,100011,,79200,79200,216000,99000,270000,20,19,1,0,1,1,16,4.631578947368421,TP. Hồ Chí Minh,2024-01-15
25152969532,473918762,YaMe.vn Official Store,Áo Thun Nam Tay Ngắn Cổ Tròn Cotton Co Giãn 4 Chiều Thời Trang Thương Hiệu Y2010  BST Thiết Kế ONE PIECE 01 22440 |YaMe|,VND,15,2023-04-11,4,5,100011,,257000,257000,257000,-1,-1,0,2,0,0,0,0,2,5.0,TP. Hồ Chí Minh,2024-01-15
18794616836,473918762,YaMe.vn Official Store,Giày Casual Nam Đơn Giản Thời Trang Thương Hiệu Y2010 Miền Gió Cát 17 22532 |YaMe|,VND,35,2023-04-11,4,3,100012,,555210,555210,555210,597000,597000,7,3,0,0,0,0,3,5.0,TP. Hồ Chí Minh,2024-01-15
17495831911,473918762,YaMe.vn Official Store,Áo Polo Nam Form Rộng Phong Cách Cá Tính Năng Động Thương Hiệu Y2010 SPEED 28 22354 |YaMe|,VND,61,2023-04-11,9,10,100011,,261360,261360,282150,297000,297000,12,3,0,0,0,0,3,5.0,TP. Hồ Chí Minh,2024-01-15
23087771791,473918762,YaMe.vn Official Store,Quần Jean Dài Nam Đơn Giản Thời Trang Thương Hiệu Y2010 PREMIUM 18 22529 |YaMe|,VND,26,2023-04-11,1,0,100011,,388570,388570,388570,427000,427000,9,1,0,0,0,0,1,5.0,TP. Hồ Chí Minh,2024-01-15
16371134094,473918762,YaMe.vn Official Store,Áo Thun Nam Tay Ngắn Cổ Tròn Ngân Hà The Earth Thương Hiệu Y2010 Ver1 20273|YaMe|,VND,16,2023-04-11,57,83,100011,,191250,191250,191250,225000,225000,15,22,0,0,0,3,19,4.863636363636363,TP. Hồ Chí Minh,2024-01-15
22459992216,473918762,YaMe.vn Official Store,Áo Polo Nam Tay Ngắn Thời Trang Thương Hiệu Y2010 Premium 27 22574  |YaMe|,VND,8,2023-04-11,24,15,100011,,263150,263150,263150,277000,277000,5,9,0,0,1,0,8,4.777777777777778,TP. Hồ Chí Minh,2024-01-15
23533620991,473918762,YaMe.vn Official Store,Áo Thun Nam Tay Ngắn Cổ Tròn Đơn Giản Thời Trang Thương Hiệu Y2010 Nguyên Bản Ver141 21833 |YaMe|,VND,14,2023-04-11,158,66,100011,,111760,111760,111760,127000,127000,12,55,0,1,0,4,50,4.872727272727273,TP. Hồ Chí Minh,2024-01-15
22652721301,473918762,YaMe.vn Official Store,Túi Đeo Chéo Nam Nữ Modern Thời Trang Thương Hiệu Y2010 SPEED 50 22392 |YaMe|,VND,15,2023-04-11,11,8,100533,,270270,270270,270270,297000,297000,9,3,0,0,0,0,3,5.0,TP. Hồ Chí Minh,2024-01-15
23147094848,473918762,YaMe.vn Official Store,Áo Thun Nam Tay Ngắn Cổ Tròn Đơn Giản Thời Trang Thương Hiệu Y2010 Cosmo 26 22202 |YaMe|,VND,110,2023-04-11,220,62,100011,,164560,164560,187000,187000,187000,12,67,0,0,1,3,63,4.925373134328358,TP. Hồ Chí Minh,2024-01-15
23951251235,473918762,YaMe.vn Official Store,Balo Daily Nam Nữ Khởi Nguyên 10 Thời Trang Thương Hiệu Y2010 22428 |YaMe|,VND,54,2023-04-11,39,20,100533,,285600,285600,285600,357000,357000,20,11,1,0,0,0,10,4.636363636363637,TP. Hồ Chí Minh,2024-01-15
18288931884,473918762,YaMe.vn Official Store,Áo Thun Trơn Nam Form Rộng Tay Ngắn Cổ Tròn Đơn Giản Thương Hiệu Y2010 TSONS 87 22035 |YaMe|,VND,85,2023-04-11,44,13,100011,,192950,192950,192950,227000,227000,15,9,0,0,0,0,9,5.0,TP. Hồ Chí Minh,2024-01-15
19480490171,473918762,YaMe.vn Official Store,Quần Jogger Kaki Nam Cá Tính Thời Trang Thương Hiệu Y2010 The Day’s Eye 16 22060 |YaMe|,VND,30,2023-04-11,22,12,100011,,361270,361270,361270,397000,397000,9,6,0,0,0,0,6,5.0,TP. Hồ Chí Minh,2024-01-15
22642954902,473918762,YaMe.vn Official Store,Áo Khoác Hoodie Nam Nữ Form Rộng Trơn Đơn Giản Thời Trang Thương Hiệu Y2010 TSONS 25 21987 |YaMe|,VND,155,2023-04-11,21,18,100011,,361270,361270,361270,397000,397000,9,7,0,0,0,0,7,5.0,TP. Hồ Chí Minh,2024-01-15
19283442461,473918762,YaMe.vn Official Store,Áo Thun Sweater Nam Nữ Unisex Cá Tính Thời Trang Thương Hiệu Y2010 SPEED 21 22363 |YaMe|,VND,129,2023-04-11,8,14,100011,,434070,434070,434070,477000,477000,9,2,0,0,0,0,2,5.0,TP. Hồ Chí Minh,2024-01-15
